产品名称,ASIN,URL,Listing月销量,实际价格( $ ),评分星级,评价数量,曝光占比,曝光占比,曝光占比,曝光占比,曝光占比,曝光占比,上架时间,品牌,卖家
Breathable Grounding Mat With Air Holes 15.7“x19.6“ for Bed Foot - Lightweight Earth Connected Pad,B0CSCY858D,https://www.amazon.com/dp/B0CSCY858D/?th=1,8,16.99,4.20,16,0.23,0.31,0,0.09,0,0,2024-01-29,XINHUSU,XINHUAI
"Grounding Mat for Bed, Grounding Sheets Blanket with Grounding Cord, Earthing Mat Grounding Pad, 95% Cotton+ 5% Silver(Grey, 27 * 52inch)",B0CT8GNSJJ,https://www.amazon.com/dp/B0CT8GNSJJ/?th=1,8,19.99,2.90,9,0.12,0.18,0,0,0,0,2024-03-14,Reaeng,speedingd
Earthing Mat 23.6'x35.4' - Colored Grounding Pad for Feet,B0CQVRZ55L,https://www.amazon.com/dp/B0CQVRZ55L/?th=1,8,46.59,4.00,94,0.25,0,0,0.88,0,0,2024-03-19,SoulHarmony,Home Brands Store
72'x23.6' Colored Earthing Mat - Grounding Pad for Bed & Feet - Yoga Exercise Mat,B0CR15S1HJ,https://www.amazon.com/dp/B0CR15S1HJ/?th=1,8,59.49,4.00,94,0.14,0.12,0,0.23,0,0,2024-03-19,SoulHarmony,Home Brands Store
Redemption Shield? 10% Silver Fiber Fitted Grounding Bed Sheet | Earthing for Better Sleep | Beige | Twin Size,B0BXKVGZ9N,https://www.amazon.com/dp/B0BXKVGZ9N/?th=1,8,134.10,4.10,49,0.01,0,0,0.05,0,0,2023-03-07,Redemption Shield,Redemption Shield
Earthing Mat 23.6“x35.4“ - Colored Grounding Pad for Feet,B0CR16SSJC,https://www.amazon.com/dp/B0CR16SSJC/?th=1,8,46.59,4.10,99,0.14,0,0,0.51,0,0,2024-03-20,SoulHarmony,Home Brands Store
"SoulHarmony Colored Grounding Mat 72'x24' - Earthing Mat for Bed, Yoga, Feet - Multicolor",B0CR1P7X6X,https://www.amazon.com/dp/B0CR1P7X6X/?th=1,8,59.49,4.10,99,0.39,0,7.16,0,0,0,2024-03-19,SoulHarmony,Home Brands Store
Grounding Mat 11.8“x23.6“ - Colored Grounding Mat Earthing - Grounding Pad for Feet - Grounding Mouse Pad - Earthing Mat,B0CQVRWJZB,https://www.amazon.com/dp/B0CQVRWJZB/?th=1,8,29.59,4.10,99,0.01,0,0,0.05,0,0,2024-03-28,SoulHarmony,Home Brands Store
Grounding Mat 11.8”x23.6” - Colored Grounding Mat Earthing - Grounding Pad for Feet - Grounding Mouse Pad - Earthing Mat,B0CQVQZBM4,https://www.amazon.com/dp/B0CQVQZBM4/?th=1,8,--,4.40,68,0.10,0,0,0.37,0,0,2024-03-29,SoulHarmony,N/A
GroundLuxe Grounding Mattress Pad for Sleep,B0C261J5XV,https://www.amazon.com/dp/B0C261J5XV/?th=1,8,159.99,4.00,72,0.13,0,2.39,0,0,0,2023-06-14,GroundLuxe,GroundLuxe
"Grounding Mat Grey for Sleeping, Grounding Sheet for Bed for Pain Relief for Wellness, Grounding Mat with Adjustable Buckles for Health, Health Gift for Families (27IN 79IN with Pen)",B0D3GZG6P1,https://www.amazon.com/dp/B0D3GZG6P1/?th=1,8,12.99,4.30,19,0.12,0.18,0,0,0,0,2024-05-07,HOOTACH,HOOTACH
"Grounding Mat 13 * 23.6, Conductive Earth Mat Grounding Pad, Grounding Mat for Bed.",B0DGPTS5M1,https://www.amazon.com/dp/B0DGPTS5M1/?th=1,8,9.99,2.10,4,0.19,0.16,0,0.33,0,0,2024-09-11,seader,seader
"Grounding Mat,Mat Improves Sleep, 15ft Grounding Cord,Grounding Pad Kit, Earth Therapy for Foot Mat,Computer Mat, Sleep Mat, Pet Mat (23.6 x 13 Inch)",B0DKJY3C8Z,https://www.amazon.com/dp/B0DKJY3C8Z/?th=1,8,10.99,4.10,22,0.10,0.14,0,0.05,0,0,2024-12-05,FXYSWGA,Most Healthy
"Grounding Mat Kit for Healthy Grounding Energy, Grounding Pad for Sleep with Grounding Wristband & 15ft Grounding Cord, for Improve Sleep and Reduce Anxiety",B0DN15MSTL,https://www.amazon.com/dp/B0DN15MSTL/?th=1,8,19.59,4.30,37,0.67,0.68,0,0.79,0,0,2024-12-14,Huanyon,JUNMENG
"Grounding Mat for Improved Sleep, Reduced Anxiety, Pain, Inflammation, Headache Relief, Balance. Grounded Therapy- (Black, (39.3 * 27.5inch))",B0DQFZNC3N,https://www.amazon.com/dp/B0DQFZNC3N/?th=1,8,49.99,2.40,4,0.46,0.70,0,0,0,0,2025-01-23,HLLBLL,Luonavei-US
Grounding Mat for Bed Breathable Grounding Foot Pad 24'x36' Sleeping Mat Earth Connected Mat Kit,B0DP9NWS3Y,https://www.amazon.com/dp/B0DP9NWS3Y/?th=1,8,22.40,4.20,16,0.04,0,0,0.14,0,0,2025-01-22,XINHUSU,XINHUAI
Grounding Mat Earth Connected Mat for Feet Pets Desk Computer Grounding Pad 24“x36“ Grounded Mat with Cord,B0DPFCD5K3,https://www.amazon.com/dp/B0DPFCD5K3/?th=1,8,21.73,3.90,2,0.04,0.04,0,0.05,0,0,2025-01-23,XINHUSU,XINHUAI
"MURT Grounding Sheets, Luxury 90% Tencel & 10% Pure Silver Fiber Grounded Fitted Sheets with Grounding Cord for Better Sleep, Queen Size 60' x 80', Gray",B0DTK34QD1,https://www.amazon.com/dp/B0DTK34QD1/?th=1,8,97.99,4.80,7,0.01,0,0,0.05,0,0,2025-03-14,MURT,Murt Direct
"Grounding Mat King, PU Leather, Grounding Mat for Bed Improves Sleeping, 54X78IN",B0C3G2NPXT,https://www.amazon.com/dp/B0C3G2NPXT/?th=1,7,36.10,4.00,38,0.03,0.04,0,0,0,0,2023-06-06,COUSLEWI,boyisheng
"Grounding Mat for Bed, PU Leather, Conductivity Therapy of Grounding Bed Mat, Improves Sleeping, Grounding Mat Pad for Feet, Queen, 27x78IN",B0CJ28KDC5,https://www.amazon.com/dp/B0CJ28KDC5/?th=1,7,53.44,4.00,38,0.03,0,0,0.09,0,0,2023-11-04,COUSLEWI,boyisheng
"seader Grounding Mat, Conductive Grounding Pad, Earth Mat with 15ft Grounding Cord 13 x 23.6",B0CSWP1CV5,https://www.amazon.com/dp/B0CSWP1CV5/?th=1,7,16.99,4.00,75,0.08,0.06,0,0.14,0,0,2024-03-11,seader,seader
"SoulHarmony Grounding Mat 72''x23.6'' - Colored Grounding Mat Earthing - Grounding Pad for Bed - Grounding Yoga Exercise Mat - Grounding Pad for Feet - Earthing Mat, Pink",B0CR16XGHH,https://www.amazon.com/dp/B0CR16XGHH/?th=1,7,59.49,4.10,86,0.48,0,7.16,0.33,0,0,2024-03-19,SoulHarmony,Home Brands Store
Grounding Mat - 23.6x35.4” Grounding Mat Earthing Colored - Grounding Pad for Feet - Grounding Mouse Pad - Grounding Mat,B0CR15J6Y9,https://www.amazon.com/dp/B0CR15J6Y9/?th=1,7,54.95,4.10,84,0.05,0.08,0,0,0,0,2024-03-20,SoulHarmony,Home Brands Store
Grounding Mat 11.8'x23.6' - Colored Grounding Mat Earthing - Grounding Pad for Feet - Grounding Mouse Pad - Earthing Mat,B0CQVRPRSL,https://www.amazon.com/dp/B0CQVRPRSL/?th=1,7,29.59,4.10,86,0.36,0.47,0,0.19,0,0,2024-04-03,SoulHarmony,Home Brands Store
"Grounding Mat for Sleep, Pain Relief and Anxiety Reduction, Earth Connection Therapy, Connects to The Earth Indoors, Includes 15ft Cord (Black, 24'x16')",B0CZ6RB9SR,https://www.amazon.com/dp/B0CZ6RB9SR/?th=1,7,19.99,4.10,42,0.14,0.21,0,0,0,0,2024-04-15,AMCOMFY,Amazing Mats
"Grounding Earthing Sheet, 95% Cotton & 5% Silver Fibers, Reduces Inflammation, Insomnia & Pain, Twin/Full/Queen/King Sizes (Queen (60' X 80'))",B0D93FYD5W,https://www.amazon.com/dp/B0D93FYD5W/?th=1,7,159.90,3.40,10,0.04,0,0,0.14,0,0,2024-08-20,GroundingWell,WellGrounded
"Grounding Sheet, Fits All Bed Sizes, Organic Cotton + Silver Fiber, 24' x 104'",B0DGFLNJ1J,https://www.amazon.com/dp/B0DGFLNJ1J/?th=1,7,24.95,3.90,45,0.01,0,0,0.05,0,0,2024-10-15,Zengrounded,WellGrounded
"Grounding Mat,Grounding Pad for Bed, Sleep Grounding Matt, Anti-Slip Breathable PU Leather Grounding Mats,Earth Connected Therapy,Improve Sleep Boost Energy,Grounding Mattress for Queen",B0DP1XVBN1,https://www.amazon.com/dp/B0DP1XVBN1/?th=1,7,21.58,3.80,24,0.10,0.16,0,0,0,0,2024-12-31,JPDINTEEM,Jinpinduo
"Grounding Mat for Bed, Grounding Pad for Feet Body Full, Earthing Mats Set with Cord",B0DM6MGL4D,https://www.amazon.com/dp/B0DM6MGL4D/?th=1,7,14.99,--,0,0.01,0,0,0.05,0,0,2024-12-05,Generic,Tengxinji
Grounding Mat for Bed Grounding Pad for Better Sleep Energy Wellness Grounding Bed Mat Carbon Fiber and PU with Grounding Cord 27'x78',B0DPHL1MWL,https://www.amazon.com/dp/B0DPHL1MWL/?th=1,7,53.08,5.00,3,0.01,0.02,0,0,0,0,2025-01-21,TALILALU,TALILALU
"Grounding Fitted Sheets for Bed, Grounding Sheets Queen Size 27'*76' with 10% Silver Fiber, Grounding Sheets for Better Sleep, Energy, Pain Relief, Inflammation, White",B0DRW164V3,https://www.amazon.com/dp/B0DRW164V3/?th=1,7,41.99,5.00,2,0.01,0,0,0.05,0,0,2025-02-18,Senedy Health,Senedy
"Grounding Fitted Sheets 90% Organic Cotton+10% Pure Silver Fiber, Grounded Sheets with Grounding Cord, Bed Grounding Kit for Healthy Sleep Therapy (Gray, (60.1 * 80 * 15.1inch))",B0DQG9C7XK,https://www.amazon.com/dp/B0DQG9C7XK/?th=1,7,149.00,3.50,7,0.01,0,0,0.05,0,0,2025-03-03,HLLBLL,Luonavei-US
"VEVOR Grounding Mat, 54 x 78 in Anti-Slip PU Leather Earthing Mat, with 15 Feet Grounding Cord, Grounding Pad for Sleep, Boost Energy, Improve Sleep, Reduce Anxiety at Home Office or Work",B0DZHBJNTP,https://www.amazon.com/dp/B0DZHBJNTP/?th=1,7,50.39,--,0,0.28,0.37,0,0.14,0,0,2025-03-09,VEVOR,Amazon
"VEVOR Grounding Mat, 27 x 78 in Anti-Slip PU Leather Earthing Mat, with 15 Feet Grounding Cord, Grounding Pad for Sleep, Boost Energy, Improve Sleep, Reduce Anxiety at Home Office or Work",B0DYJ75FFZ,https://www.amazon.com/dp/B0DYJ75FFZ/?th=1,7,38.99,--,0,0.01,0.02,0,0,0,0,2025-03-03,VEVOR,Amazon
"VEVOR Grounding Mat, 27 x 39 in Anti-Slip PU Leather Earthing Mat, with 15 Feet Grounding Cord, Grounding Pad for Sleep, Boost Energy, Improve Sleep, Reduce Anxiety at Home Office or Work",B0DZ2F1WKL,https://www.amazon.com/dp/B0DZ2F1WKL/?th=1,7,29.99,--,0,0.01,0,0,0.05,0,0,2025-03-14,VEVOR,Amazon
"Grounding Mat for Bed with Leather, Improve Sleep, Relieve Stress & Pain, Anti-Slip & Eco-Friendly PU Leather, Includes Grounding Cord & Sleep Mask for Enhanced Rest(Queen-27’’×60’’)",B0F8Q6FHC4,https://www.amazon.com/dp/B0F8Q6FHC4/?th=1,7,39.99,4.90,31,0.12,0.16,0,0.05,0,0,2025-01-09,IKNUH,IKNUH Direct
"Grounding Mat for Bed with Leather, Improve Sleep, Relieve Stress & Pain, Anti-Slip & Eco-Friendly PU Leather, Includes Grounding Cord & Sleep Mask for Enhanced Rest(King-27’’×78’’)",B0F8Q4YC28,https://www.amazon.com/dp/B0F8Q4YC28/?th=1,7,43.99,4.90,31,0.03,0.04,0,0,0,0,--,IKNUH,IKNUH Direct
"ESD Soldering Mat Kit (Made in USA), 2 Feet Wide x 4 Feet Long x 0.06 Inches Thick, Blue, Includes a Wrist Strap and Grounding Cord, RoHS and REACH Compliant - 2059USA-2x4BKT",B072KRLS8S,https://www.amazon.com/dp/B072KRLS8S/?th=1,5,158.83,4.20,72,0.01,0,0,0.05,0,0,2017-09-26,Bertech,Bertech Inc.
ESD Anti-Static HIGH Temperature Soldering MAT - 24“ X 48“ (2‘ X 4‘) - 0.08“ Thick - Dual Bench Ground Mount Wrist Strap - Blue,B07DM6YWV1,https://www.amazon.com/dp/B07DM6YWV1/?th=1,5,--,5.00,4,0.01,0,0,0.05,0,0,2018-11-06,Scientific Americas,N/A
Far Infrared Heating Pad for Back - Infrared Mat Full Body - Amethyst Mat - Bio Crystal Mat - 5 Color Natural Gemstones Heating Pad with Overheat Protection and Auto Off Function(67'x27'),B088NZBF9R,https://www.amazon.com/dp/B088NZBF9R/?th=1,5,340.99,4.50,227,0.01,0,0.24,0,0,0,2020-05-29,PHYMAT,SHUNDI
"Far Infrared Heating Pad for Back,Full Body Amethyst Heating Pad,Gemstone Amethyst Obsidian Crystal Mat,Enhanced Reki, Yoga and Meditation Bio Mats(59x24inch)",B0923PW2DZ,https://www.amazon.com/dp/B0923PW2DZ/?th=1,5,280.00,4.60,41,0.01,0,0.24,0,0,0,2021-05-14,PHYMAT,SHUNDI
"LandKissing? Grounding Mats 26.7' x9.8” (1 PK), Grounding Mat Kit for Bed, Office, Living Room, Kitchen. Benefit Earth Grounding Energy with 2 Bracelets and 2 15ft-Long Grounding Cords.",B07GV6NL4Z,https://www.amazon.com/dp/B07GV6NL4Z/?th=1,5,32.99,4.20,510,0.46,0.70,0,0,0,0,2018-09-29,LandKissing,"New Earth Industrial CO., Limited"
"Grounding Mat, 35.4' x 23.6', Large, Soft, Leather, Spot Clean Only, Grounding",B07XWB1QY4,https://www.amazon.com/dp/B07XWB1QY4/?th=1,5,29.99,4.00,163,0.48,0.41,0,0.74,0,0,2019-10-10,OCENSGRD,jinmutu
"Grounding Mat, Universal Earth Energy Pad for Healthy, Eliminate Static Improve Sleep, Reduce Inflammation Pain and Anxiety, for Foot or Desk Use, Soft and Conductive",B09WN2MPDG,https://www.amazon.com/dp/B09WN2MPDG/?th=1,5,37.99,3.50,34,0.23,0.14,0,0.51,0,0,2022-05-31,KooMall,Koomall
"Amerthing Grounding Mats - Upgraded Healthy Conductive Energy Pads to Earth for Bed and Seats to Sleep Better and Recovery, 100% Silver Fiber Indoor and Portable Relax Blanket.",B07Y53SW8X,https://www.amazon.com/dp/B07Y53SW8X/?th=1,5,33.74,4.00,43,0.18,0.27,0,0,0,0,2021-01-14,Amerthing,Amerthingfactory
"Upgraded Yoga Fitness for Earth Grounding, Universal Mat with Grounding Cord and Rod, Eco-friendly TPE, Anti-skid-Therapy, Potential EMF and ESD Protection 71x24 inch",B07XY6HVZ8,https://www.amazon.com/dp/B07XY6HVZ8/?th=1,5,89.38,4.40,9,0.01,0,0,0.05,0,0,2019-09-27,Amerthing,Amerthingfactory
"Grounding Mat, Grounding Mattress Cover Pad Grounding Sheets with Grounding Products Kit for Improving Sleeping, Relieve Pain (27 x 71 Inch)",B0BV5N9GLK,https://www.amazon.com/dp/B0BV5N9GLK/?th=1,5,59.98,4.30,17,0.30,0.45,0,0,0,0,2023-03-14,TINGMHUA,TAO LLC
"Grounding Sheets Kit, Flat Sheets with 5% Silver Fiber Organic Cotton,Grounding,Earth Bed Sheets (27 * 52IN-Grey)",B0BWY1R5FM,https://www.amazon.com/dp/B0BWY1R5FM/?th=1,5,32.54,3.50,15,0.01,0,0,0.05,0,0,2023-05-03,KLASLAV,zhifandianzicailiao
"Grounding Mat with 15ft Grounding Cord,Grounding Pad Kit, Earth Therapy for Foot Mat,Computer Mat, Sleep Mat, Pet Mat (23.6x13 Inch)",B0BZSPB7V7,https://www.amazon.com/dp/B0BZSPB7V7/?th=1,5,16.99,4.20,277,0.01,0,0,0.05,0,0,2023-05-11,FXYSWGA,Most Healthy
"Grounding Mat, Desk, Floor, Grounding Mat for Sleeping Better with A Storage Bag, Grounding Pad for Pain Relieve with a 15 Feet Grounding Cord, Improve Sleep and Helps with Anxiety(26.7x10 Inch)",B0BZSSC4PL,https://www.amazon.com/dp/B0BZSSC4PL/?th=1,5,15.99,4.20,277,0.36,0.47,0,0.19,0,0,2023-05-21,FXYSWGA,Most Healthy
"Grounding Mat Kit (2 Packs), 2 Grounding Pads with 2 Grounding Cables and 2 Grounding Wristbands, Re-Connect The Earth, Relieve Stress and Anxiety, Reduce Pain, Balance Physical Fitness",B0C3CYTDFH,https://www.amazon.com/dp/B0C3CYTDFH/?th=1,5,43.58,3.90,54,0.01,0,0,0.05,0,0,2023-06-07,COUSLEWI,boyisheng
"Grounding Mat, Grounding Bed Foot Mat with 1 Grounding Cord Indoor Mat Improving Sleep Health Grounding Therapy Reduce Anxiety Inflammation Pain Earth Connect (11.8 * 23.6inch)",B0C68FVMD8,https://www.amazon.com/dp/B0C68FVMD8/?th=1,5,11.89,3.70,28,0.23,0.27,0,0.19,0,0,2023-07-06,WAUZOBLE,suqianshiqianrunxinxikejiyouxiangongsi
WAUZOBLE Grounding Mat Sleeping Foot Mat Improve Insomnia Reduce Inflammation Pain Headache Static Earth Therapy Grounding Products with 15 FT Black Cord (23.6 * 35.4inch),B0C5CC3BFH,https://www.amazon.com/dp/B0C5CC3BFH/?th=1,5,25.41,4.20,80,0.01,0,0,0.05,0,0,2023-07-10,WAUZOBLE,suqianshiqianrunxinxikejiyouxiangongsi
RIQINXIN Conductive Grounding Mat Grounding Mat for Bed Grounding Mattress Cover Durable Breathable Grounding Sleep Pad 28x71in Black,B0C67X72NR,https://www.amazon.com/dp/B0C67X72NR/?th=1,5,39.99,3.20,2,0.01,0,0,0.05,0,0,2023-09-04,RIQINXIN,Jezhilim
"Grounding Mat with 15ft Grounding Cord,Grounding Pad Kit, Earth Therapy for Foot Mat,Computer Mat, Sleep Mat, Pet Mat (23.6” x 13”)",B0CGLR8KMM,https://www.amazon.com/dp/B0CGLR8KMM/?th=1,5,21.99,3.80,21,0.08,0,0,0.28,0,0,2023-09-06,N/A,jinmutu
"Universal Grounding Mat for Bed or Desk: Connect with The Earth for Optimal Grounding, Includes 15ft Grounding Cord",B0CGXQVRNB,https://www.amazon.com/dp/B0CGXQVRNB/?th=1,5,34.95,4.50,23,0.08,0.12,0,0,0,0,2023-09-09,Nasafes,nasafes
"WAUZOBLE Grounding Mat for Bed, Grounding Mattress Pad for Sleeping, Conductive Carbon Leatherette Grounding Mattress Cover with Elastic Straps for Efficient Sleep, Relieve Pain and Stress（54x72）",B0CGRJ4THL,https://www.amazon.com/dp/B0CGRJ4THL/?th=1,5,66.99,3.70,10,0.01,0,0,0.05,0,0,2023-09-14,WAUZOBLE,suqianshiqianrunxinxikejiyouxiangongsi
"Grounding Mat for Bed, Grounding Mattress Pad for Sleeping, Conductive Carbon Leatherette Grounding Mattress Cover with Elastic Straps for Efficient Sleep, Relieve Pain and Stress（27x72）",B0CGRHV943,https://www.amazon.com/dp/B0CGRHV943/?th=1,5,49.68,3.90,41,0.01,0,0,0.05,0,0,2023-10-03,WAUZOBLE,suqianshiqianrunxinxikejiyouxiangongsi
"Grounding Sheet Kit, 5% Silver Fiber Organic Cotton,Grounding Flat Sheets,Earth Bed Sheets (35 * 90IN-Grey)",B0BWY2HCCG,https://www.amazon.com/dp/B0BWY2HCCG/?th=1,5,39.42,4.20,23,0.03,0,0,0.09,0,0,2023-03-27,KLASLAV,zhifandianzicailiao
Grounding Bed Mat，27' x78 Earth Grounding Mattress Pad with 15Ft Grounding Cord to Improve Sleep,B0CM3NMWHT,https://www.amazon.com/dp/B0CM3NMWHT/?th=1,5,38.96,3.60,23,0.04,0.06,0,0,0,0,2023-12-03,KABOUQI,kabuqi
"Grounding Mat with 15ft Grounding Cord - 11.8x27.6 Inch Earth Mat for Better Sleep, Stress Relief, Anxiety & Pain Reduction",B0CLXX2P1T,https://www.amazon.com/dp/B0CLXX2P1T/?th=1,5,26.88,4.50,29,0.15,0.23,0,0,0,0,2023-11-05,KABOUQI,kabuqi
"MATFORTH Grounding Mat Kit,Universal Grounding Mat with with 15ft Grounding Cord, Ground Foot Mats, Computer Mat, Sleep Mat, Keep Healthy(11.8” x 39”)",B0CNR322G4,https://www.amazon.com/dp/B0CNR322G4/?th=1,5,22.49,3.60,18,0.09,0.14,0,0,0,0,2023-12-30,MATFORTH,earthyogic
Grounding Mattress Pad for Better Sleep - 27x78 Inch Breathable Bed Mat with 15ft Grounding Cord & Secure Fit Straps,B0CPHWWBXS,https://www.amazon.com/dp/B0CPHWWBXS/?th=1,5,26.00,3.70,29,0.01,0,0,0.05,0,0,2023-12-30,MATFORTH,earthyogic
"LOSUVERO Grounding Mat Kit for Improving Sleep, Floral Printed Grounding Pad for Healthy Therapy, Efficient Sleep, Reduce Stress, Energy, Pain Relief 12 * 24IN",B0CSP2RVD8,https://www.amazon.com/dp/B0CSP2RVD8/?th=1,5,23.99,4.00,22,0.40,0.60,0,0,0,0,2024-02-16,LOSUVERO,FENGNUAN
"Far Infrared Heating Pad,Infrared Mat Full Body,7 Color Gemstone Heating Pad,7 Chakra Yoga Meditation Crystal Bio Mat,Auto Shut Off,Adjustable Temp(67'x27')",B089W4NM2R,https://www.amazon.com/dp/B089W4NM2R/?th=1,5,379.99,4.10,27,0.01,0,0.24,0,0,0,2020-07-17,PHYMAT,SHUNDI
"Grounding Sheets 35 * 90 inch, Conductive Grounding Sheets with Grounding Cord, Grounding Sheets for Earth with Silver Fiber with Cotton, White",B0CRV7HBBZ,https://www.amazon.com/dp/B0CRV7HBBZ/?th=1,5,20.99,3.60,21,0.01,0.02,0,0,0,0,2024-03-14,YEOUMIAR,YOUMIAO
"Grounding Mat for Bed, Grounding Sheets Blanket with Grounding Cord, Earthing Mat Grounding Pad, 95% Cotton+ 5% Silver Fiber (Beige, 27 * 52inch)",B0CT8HGL5N,https://www.amazon.com/dp/B0CT8HGL5N/?th=1,5,12.99,3.80,10,0.01,0.02,0,0,0,0,2024-02-20,Reaeng,speedingd
"Grounding Mat 23.6 * 35.4', Grounding Mat for Bed, Grounded Therapy Earth Mat Grounding Pad for Sleep, Pain Relief",B0CSWR17W2,https://www.amazon.com/dp/B0CSWR17W2/?th=1,5,19.99,3.70,56,0.15,0,0,0.56,0,0,2024-03-06,seader,seader
"Grounding Mat for Feet, Earth Therapy Grounded Pad for Improved Sleep & Pain Relief (11.8x27.6in)",B0CVX8983D,https://www.amazon.com/dp/B0CVX8983D/?th=1,5,14.96,4.00,14,0.18,0.27,0,0,0,0,2024-03-24,MINPWNP,BOYUEGE
"LOYDBDT Grounding Mat,23.6x35.4inches,Grounding Mat with 15ft Grounding Cord,Universal Grounding Pad, Grounding Yoga Mat,Improve Health,Grounding Mat for Bed,Promote blood circulation, black",B0CX1QXNGP,https://www.amazon.com/dp/B0CX1QXNGP/?th=1,5,19.20,3.80,14,0.01,0,0,0.05,0,0,2024-04-03,LOYDBDT,LOYDBDT
"Universal Mat Kit 2 Pack，11.8'x23.6' Printed Grounding Mat with 15FT Grounding Wire, Grounding Mat for Sleep, Energy, Pain Relief,Conductive Carbon (2 Pack) (Black, 11.8 * 23.6)",B0CW9DNQPB,https://www.amazon.com/dp/B0CW9DNQPB/?th=1,5,25.64,4.20,12,0.09,0,0,0.33,0,0,2024-03-18,YEOUMIAR,YOUMIAO
"HRSDZKJ Grounding Mat for Sleep, Healthy Grounding Energy with Grounding Wristband and 15ft Straight Cord, Reduce Inflammation, Improve Sleep and Helps with Anxiety(26.7x10 Inch), Black",B0CY2FW16X,https://www.amazon.com/dp/B0CY2FW16X/?th=1,5,15.99,3.60,43,0.05,0.06,0,0.05,0,0,2024-04-14,HRSDZKJ,hairuida
"Grounding Mat for Improving Sleeping and 2 Grounding Cords, Grounding Sheet with 16 Feet Cord for Relieving Pain, Stress, Grounding Pad for Pain Relieving with Test (27 71IN 2 Cords Pen)",B0CXN24T6G,https://www.amazon.com/dp/B0CXN24T6G/?th=1,5,55.89,3.90,25,0.01,0,0,0.05,0,0,2024-04-18,HETESER,HETESER
"Grounding Mat for Sleep with 15ft Grounding Cord,Grounding Pad Kit, Earth Therapy for Foot Mat,Computer Mat, Sleep Mat, Pet Mat(26.7x10 Inch)",B0CXX29PFH,https://www.amazon.com/dp/B0CXX29PFH/?th=1,5,17.99,3.90,30,0.15,0.23,0,0,0,0,2024-04-14,HRSDZKJ,hairuida
"Grounding Mat for Bed, Grounding Sheets Blanket with Grounding Cord, Earthing Mat Grounding Pad, 95% Cotton+ 5% Silver Fiber (Grey, 72x84inch)",B0CT8HNCGT,https://www.amazon.com/dp/B0CT8HNCGT/?th=1,5,49.99,4.50,2,0.01,0,0,0.05,0,0,2024-03-14,Reaeng,speedingd
"STARLENGET Grounding Blanket for for Bed Sleeping Therapy, Pain Relief,Imrpoving Sleep. Grounded Throw Kit, Conductive Silver Fiber Blanket. Grounding Cord Included 80 x 55 Inch Throw",B0CXCFGWYL,https://www.amazon.com/dp/B0CXCFGWYL/?th=1,5,99.98,4.80,6,0.04,0,0,0.14,0,0,2024-04-19,STARLENGET,Dorisx
Rubber ESD Anti-Static HIGH Temperature Soldering MAT KIT-30” X 60” (2.5’ x 5’) - 0.08” Thick- with Dual Point and Wrist Strap-Green,B07DPVBX1C,https://www.amazon.com/dp/B07DPVBX1C/?th=1,5,101.00,4.10,6,0.01,0,0,0.05,0,0,2019-11-17,Scientific Americas,Scientific Americas
"Grounding Fitted Sheet with Conductive Grounding Cable, Conductive Grounded Mat for Better Sleep, Wellbing, Sleep Assits, Snore Relief, Anxiety Relaxtion (White, King)",B0CXLNGF57,https://www.amazon.com/dp/B0CXLNGF57/?th=1,5,50.34,4.30,12,0.03,0,0,0.09,0,0,2024-04-12,CHIAOCHUTTY,ChangChunShiQiHaoYuanJingMaoYouXianGongSi
"Grounding Mat,Conductive Grounding Pad, Earth Mat with 15ft Grounding Cord, Universal Grounding Mat for Pain Relief, Inflammation, Balance(23.6x13 Inch)",B0CXWYNVYK,https://www.amazon.com/dp/B0CXWYNVYK/?th=1,5,19.99,4.00,16,0.01,0,0,0.05,0,0,2024-04-13,HRSDZKJ,hairuida
"LOYDBDT Grounding Mat with 15ft Grounding Cord,Grounding Bed Mat,Ultra Soft PU Leather,Grounding Therapy Improve Health,Grounding Foot Mat,Relieve Anxiety and Pain,11.8x39inches, Black",B0CY1YZPG1,https://www.amazon.com/dp/B0CY1YZPG1/?th=1,5,14.95,4.30,12,0.04,0.06,0,0,0,0,2024-03-26,LOYDBDT,LOYDBDT
"Grounding Blanket - Size 55' x 79'inch, Grounding Sheet Connected Earth for Better Sleep, Relieve Pain, Earthing Bed Blanket with Grounding Cord",B0D1GCN6DW,https://www.amazon.com/dp/B0D1GCN6DW/?th=1,5,77.39,4.10,2,0.01,0,0,0.05,0,0,2024-04-12,NEWARR,New Housing
"Grounding Mats Ground Pattern Yoga Mat 23.6x35.4 In Earth Foot Mats, Grounding Mats for Sleeping,Dogs,Work,Grounding Therapy Mat",B0CZ6XJPL6,https://www.amazon.com/dp/B0CZ6XJPL6/?th=1,5,21.59,4.30,21,0.18,0.27,0,0,0,0,2024-04-11,LAXVAPIU,MAOKE
"Grounding Mat for Bed (27”x78”) C Includes 15ft Grounding Cord, Relieves Stress, Pain, and Anxiety",B0CW18P133,https://www.amazon.com/dp/B0CW18P133/?th=1,5,50.56,4.30,3,0.01,0,0,0.05,0,0,2024-04-12,MINPWNP,BOYUEGE
"Grounding Mat Grey Color for Bed for Sleeping Better, Conductive Carbon PU Leather Grounding Mat with A Testing Pen, Grounding Sheet for Pain Relief, Stress, Inflammation, Relaxation (27IN 59IN Pen)",B0D2SQDNHY,https://www.amazon.com/dp/B0D2SQDNHY/?th=1,5,29.99,3.50,2,0.13,0,0,0.46,0,0,2024-06-20,LDDJIOD,LDDJIOD
"LandKissing? Grounding Mats 24“x16“ (1 PK) for Bed, Grounding Mat Kit for Improved Sleep, Lower Anxiety, Inflammation,Benefit Grouding Kit with Adapter Splitter and 25-ft Extended Long Grounding Cord",B0CPPGWZH6,https://www.amazon.com/dp/B0CPPGWZH6/?th=1,5,34.99,4.20,26,0.04,0,0,0.14,0,0,2023-12-23,LandKissing,"New Earth Industrial CO., Limited"
"Grounding Mat Kit, Grounding Mats for Anxiety, Inflammation Relief. Grounding Mat for Bed, Grounding Therapy Can Improve Sleep and Fatigue, Used As Grounding Pad for Home, Office.(13 * 30 inch)",B0D5CRK989,https://www.amazon.com/dp/B0D5CRK989/?th=1,5,33.88,3.80,15,0.01,0.02,0,0,0,0,2024-07-05,XRDDFL,HIPISTICK STORE
"Grounding Mat for Bed, Earth Mat Grounding Pad for Queen Size Bed, Earth Connected Conductive Grounding Mat for Sleep, Energy, Pain Relief, Inflammation, Balance, Wellness, 27“x60“",B0D7TQ686R,https://www.amazon.com/dp/B0D7TQ686R/?th=1,5,29.99,3.50,28,0.26,0.35,0,0.09,0,0,2024-07-20,seader,seader
"Grounding Mat (23.6x35.4 Inch) Earth Connected Therapy Mat.Universal Yoga Mat,Sleep Mat,Improve Sleep, Energy, Pain Relief, Inflammation, Balance, Wellness.15 Ft Cord Included.",B0D63F6MTS,https://www.amazon.com/dp/B0D63F6MTS/?th=1,5,23.99,3.90,21,0.04,0,0,0.14,0,0,2024-07-12,NPCSYYDS,No.1 Gift Shop
"Zenful Living Earth Grounding Blanket, 40 x 60 inches, with 15 ft Grounding Cord for Earthing, Black",B0D849W97R,https://www.amazon.com/dp/B0D849W97R/?th=1,5,97.99,4.70,12,0.01,0,0,0.05,0,0,2024-06-26,Zenful Living,Zenful Living LLC
"Grounding Sheet, Grounding Sheet with Silver Fiber & Organic Cotton Grounding Sheet for Bed with Grounding Cord Improve Sleep Help with Anxiety (35x90 Inch Gray",B0D86M4SW9,https://www.amazon.com/dp/B0D86M4SW9/?th=1,5,39.66,4.10,29,0.08,0,0,0.28,0,0,2024-07-13,MIUQAOKL,MIUQAOKL
"Grounding Mat for Working, Grounding Mouse Mat Reduce Stress, Grounding Mouse Pad for Health and Better Sleep 9.8”*11.8” in",B0BRXKCDQ2,https://www.amazon.com/dp/B0BRXKCDQ2/?th=1,5,17.85,3.70,15,0.15,0.19,0,0.09,0,0,2023-01-11,VAJOOCLL,baixundianzi
"Grounding Mat for Feet, 3MM Thickened Large Grounding Pad for Working, Yoga, Earthing Mat for Improve Sleep, Inflammation, Pain Relief, Relieve Anxiety",B0D8VHPCP4,https://www.amazon.com/dp/B0D8VHPCP4/?th=1,5,29.99,4.00,20,0.27,0.41,0,0,0,0,2024-08-08,RBFSAH,OpulentGlam Inc.
"Grounding Mat for Bed for Improve Sleep, Inflammation, Pain Relief, 23 x 35 inch 3MM Thickened Large Grounding Mat Earthing for Working, Yoga, Living Room, Kitchen, Relieve Anxiety and Stress",B0D8VJDGD7,https://www.amazon.com/dp/B0D8VJDGD7/?th=1,5,49.99,4.00,20,0.03,0,0,0.09,0,0,2024-08-12,RBFSAH,OpulentGlam Inc.
"Generic Earth Grounding Mat - Improve Sleep, Anxiety, Pain, Inflammation, Headache Relief - Black Conductive Material",B0CWNM7HV2,https://www.amazon.com/dp/B0CWNM7HV2/?th=1,5,29.99,3.60,29,0.01,0,0,0.05,0,0,2024-05-07,AKA Wellness,KSN Sellers Group
Grounding Sheet King Improve Sleep Conductive Grounding Bed Sheet 10% Pure Silver with 15ft Grounding Cord 76x80in Gray,B0D25YV3ZQ,https://www.amazon.com/dp/B0D25YV3ZQ/?th=1,5,64.99,3.60,3,0.01,0,0,0.05,0,0,2024-07-10,VigorVortex,VigorVortex
"Grounding Mat for Bed, Earth Mat Grounding Pad for King Size Bed, Earth Connected Conductive Grounding Mat for Sleep, Energy, Pain Relief, Inflammation, Balance, Wellness, 27'x78'",B0D7TR5RDQ,https://www.amazon.com/dp/B0D7TR5RDQ/?th=1,5,39.99,3.90,17,0.04,0,0,0.14,0,0,2024-07-11,seader,seader
