产品名称,ASIN,URL,Listing月销量,实际价格( $ ),评分星级,评价数量,曝光占比,曝光占比,曝光占比,曝光占比,曝光占比,曝光占比,上架时间,品牌,卖家
产品名称,ASIN,,Listing月销量,实际价格( $ ),评分星级,评价数量,全部( % ),自然位( % ),品牌广告( % ),SP广告( % ),视频广告( % ),推荐( % ),上架时间,品牌,卖家
"ACTIVE Mold Stain Remover Gel Cleaner Heavy Duty Stain Cleaner for Front Loader Washing Machine Seal, Bathroom Grout, Shower, Caulk - Front Load Washer Cleaning Solution - 7 Fl Oz",B0CTS8VQ85,https://www.amazon.com/dp/B0CTS8VQ85/?th=1,122156,15.95,4.10,7359,0.01,0,0.24,0,0,0,2024-06-04,ACTIVE,ACTIVE Official
"Earth Breeze Laundry Detergent Sheets Fresh Scent - 60 Loads Eco Liquidless Soap - Travel-Friendly for Hot & Cold Cycles, Tackles Tough Stains & Odors - Gentle on Skin, 30 Ct",B08GF7YGCD,https://www.amazon.com/dp/B08GF7YGCD/?th=1,112961,12.59,4.40,92289,0.01,0,0,0,1.96,0,2021-05-05,Earth Breeze,Earth Breeze
"Washing Machine Cleaner Descaler 24 Pack - Deep Cleaning Tablets For HE Front Loader & Top Load Washer, Septic Safe Eco-Friendly Deodorizer, Clean Inside Drum and Laundry Tub Seal - 12 Month Supply",B08DVFZTTG,https://www.amazon.com/dp/B08DVFZTTG/?th=1,107611,17.95,4.60,139348,0.01,0,0.24,0,0,0,2020-10-09,ACTIVE,ACTIVE Official
"Life Extension Neuro-Mag Magnesium L-Threonate, Magnesium L-threonate, Memory Health, Quick Thinking, Cognitive Health Support, Vegetarian, Non-GMO, 90 Vegetarian Capsules",B006P536E6,https://www.amazon.com/dp/B006P536E6/?th=1,74745,30.74,4.50,20663,0.01,0,0.24,0,0,0,2017-10-12,Life Extension,Amazon
"NMNH Supplement Alternative - Liposomal NAD with Resveratrol - High Purity NAD Supplement for Anti-Aging, Energy, Focus - 60 Capsules",B0CFZLNC5F,https://www.amazon.com/dp/B0CFZLNC5F/?th=1,53001,29.24,4.30,4898,0.01,0,0.24,0,0,0,2023-08-19,Cata-Kor,Cata-Kor
"Muddy Mat? Shown on TV C Super Absorbent Microfiber Dog Door Mat for Muddy Paws, Non-Slip Washable Pet Rug, Quick Dry Chenille Entryway Carpet, Machine Washable Indoor Outdoor mat, Grey 30'x19'",B08N6VLJKV,https://www.amazon.com/dp/B08N6VLJKV/?th=1,46567,24.95,4.60,27116,0.01,0,0,0.05,0,0,2020-11-11,Muddy Mat,The Virality Gifts
Oura Ring 4 Sizing Kit - Size Before You Buy Oura Ring 4 - Unique Sizing - Receive Credit for Purchase,B0D9WVWXR1,https://www.amazon.com/dp/B0D9WVWXR1/?th=1,35752,10.00,4.20,3127,0.03,0,0.48,0,0,0,2024-08-14,OURA,Amazon
Oura Ring 4 - Silver - Size 8 - Smart Ring - Size First with Oura Ring 4 Sizing Kit - Sleep Tracking Wearable - Heart Rate - Fitness Tracker - Up to 8 Days of Battery Life,B0D9WVSZ56,https://www.amazon.com/dp/B0D9WVSZ56/?th=1,35752,349.00,4.20,3129,0.03,0,0.48,0,0,0,2024-08-14,OURA,Amazon
Oura Ring 4 - Gold - Size 8 - Smart Ring - Size First with Oura Ring 4 Sizing Kit - Sleep Tracking Wearable - Heart Rate - Fitness Tracker - Up to 8 Days of Battery Life,B0D9WVKXLK,https://www.amazon.com/dp/B0D9WVKXLK/?th=1,35752,499.00,4.20,3128,0.03,0,0.48,0,0,0,2024-08-14,OURA,Amazon
AXV Vibration Plate Fitness Platform Exercise Machine Vibrating Lymphatic Drainage Shaking Full Body Shaker Workout Vibrate Stand Shake Board Sport Gym for Weight Loss Fat Burner for Women Men,B09MKSCYY6,https://www.amazon.com/dp/B09MKSCYY6/?th=1,32880,84.98,4.50,6578,0.01,0,0,0,1.96,0,2022-03-18,AXV,AXV SPORTS
"Retrospec Solana Yoga Mat 1' Thick With Nylon Carry Strap for Men & Women - Non Slip Exercise Mat for Home Yoga, Pilates, Stretching, Floor & Fitness Workouts",B092XNCFF7,https://www.amazon.com/dp/B092XNCFF7/?th=1,24932,39.99,4.60,12354,0.01,0.02,0,0,0,0,2021-04-24,Retrospec,Amazon
"ProsourceFit Puzzle Exercise Mat ? in, EVA Interlocking Foam Floor Tiles for Home Gym, Mat for Home Workout Equipment, Floor Padding for Kids, Cream, 24 in x 24 in x ? in, 24 Sq Ft - 6 Tiles",B07YN1W5W3,https://www.amazon.com/dp/B07YN1W5W3/?th=1,20848,54.99,4.60,56179,0.35,0.53,0,0,0,0,2020-02-01,ProsourceFit,Amazon
Methylene Blue Pharmaceutical Grade 2ozC USP Grade 1% Solution with Balanced Electrolyte SolutionThird-Party Tested Brain Health Supplement for Humans CNo Formaldehyde High Cognitive Support,B0DWZNJBF7,https://www.amazon.com/dp/B0DWZNJBF7/?th=1,13867,17.98,4.60,147,0.04,0,0,0.14,0,0,2025-02-14,Artnaturals,ArtNaturals US
"ProsourceFit Acupressure Mat and Pillow Set for Back/Neck Pain Relief and Muscle Relaxation, Large - Black/Pink",B00N24PK42,https://www.amazon.com/dp/B00N24PK42/?th=1,12359,18.73,4.20,50853,0.44,0.64,0.24,0,0,0,2015-04-03,ProsourceFit,Amazon
ProsourceFit Acupressure Mat and Pillow,B00N24PK6A,https://www.amazon.com/dp/B00N24PK6A/?th=1,12359,18.73,4.20,50853,0.01,0,0.24,0,0,0,2015-04-03,ProsourceFit,Amazon
"ProsourceFit Acupressure Mat and Pillow Set for Back/Neck Pain Relief and Muscle Relaxation, Large - Black/Pink",B00I1QCPIK,https://www.amazon.com/dp/B00I1QCPIK/?th=1,12359,19.19,4.20,50853,0.01,0,0.24,0,0,0,2014-04-04,ProsourceFit,Amazon
"Gym Flooring Set - Interlocking EVA Soft Foam Floor Mat, 18 Pieces Puzzle Rubber Tiles Protective Ground Surface Protection, Play Workout Exercise Mats Underlay Matting Sports Pool Home Fitness Garage",B019DZDM3O,https://www.amazon.com/dp/B019DZDM3O/?th=1,11869,29.74,4.30,19622,0.44,0.64,0.24,0,0,0,2020-04-27,BeMaxx,PLConcepts
"Gym Flooring Set - Interlocking EVA Soft Foam Floor Mat, 18 Pieces Puzzle Rubber Tiles Protective Ground Surface Protection, Play Workout Exercise Mats Underlay Matting Sports Pool Home Fitness Garage",B0C9KY888B,https://www.amazon.com/dp/B0C9KY888B/?th=1,11869,31.49,4.30,19590,0.01,0,0.24,0,0,0,2023-10-10,BeMaxx,PLConcepts
"Gym Flooring Set - Interlocking EVA Soft Foam Floor Mat, 18 Pieces Puzzle Rubber Tiles Protective Ground Surface Protection, Play Workout Exercise Mats Underlay Matting Sports Pool Home Fitness Garage",B0C9KH2BJ9,https://www.amazon.com/dp/B0C9KH2BJ9/?th=1,11869,40.99,4.30,19610,0.01,0,0.24,0,0,0,2023-08-04,BeMaxx,PLConcepts
"NMNH Supplement Alternative - Liposomal NAD CORE LipoNAD 250mg - 30-Day Supply - High Purity NAD Supplement for Anti-Aging, Energy, Focus - 60 Capsules",B0DTHKJH57,https://www.amazon.com/dp/B0DTHKJH57/?th=1,11443,25.99,4.50,167,0.01,0,0.24,0,0,0,2025-01-21,Cata-Kor,Cata-Kor
"Hooga Grounding Mat for Sleep, Energy, Pain Relief, Inflammation, Balance, Wellness. Earth Connected Therapy. Indoor Grounding at Home, Office, Work. 15 Foot Cord Included. Conductive Carbon",B07VSRK68V,https://www.amazon.com/dp/B07VSRK68V/?th=1,11145,24.95,4.10,5019,1.32,0.64,0,3.21,0,0,2019-09-25,hooga,Hooga Health
"Hooga Grounding Mat for Sleep, Energy, Pain Relief, Inflammation, Balance, Wellness. Earth Connected Therapy. Indoor Grounding at Home, Office, Work. 15 Foot Cord Included. Conductive Carbon (2 Pack)",B08W29GFK5,https://www.amazon.com/dp/B08W29GFK5/?th=1,11145,54.99,4.20,1007,0.03,0,0,0.09,0,0,2021-02-05,hooga,Hooga Health
"Yoga Mat Non Slip, Eco Friendly Fitness Exercise Mat with Carrying Strap,Pro Yoga Mats for Women,Workout Mats for Home, Pilates and Floor Exercises",B07JQCVBBZ,https://www.amazon.com/dp/B07JQCVBBZ/?th=1,8858,28.99,4.50,8814,0.04,0.06,0,0,0,0,2020-03-10,Gruper,Amazon
"3ftx50ft Weed Barrier Landscape Fabric Heavy Duty，Weed Block Gardening Ground Cover Mat, Weed Control Garden Cloth ，Woven Geotextile Fabric for Underlayment，Commercial Driveway Fabric",B0BF12PW67,https://www.amazon.com/dp/B0BF12PW67/?th=1,8650,14.98,4.30,2974,0.46,0.70,0,0,0,0,2022-09-16,LGJIAOJIAO,LGJIAOJIAO
"LAVEVE 4FT x 100FT Weed Barrier Landscape Fabric, 3.2oz Premium Heavy Duty Garden Cloth, Ground Cover for Gardening, Farming with 30 U-Shaped Securing Pegs",B09VGL18TV,https://www.amazon.com/dp/B09VGL18TV/?th=1,8559,33.99,4.40,1668,0.13,0.19,0,0,0,0,2022-03-25,LAVEVE,KIP-US
"WORKPRO Extra Thick Kneeling Pad, Soft Foam Cushioning for Knee, Large Foam Kneeler Mat for Gardening, Bathing Baby, Workout Supplies, 17.5 x 11 x 1.5 in, Black",B0BVVDC3KH,https://www.amazon.com/dp/B0BVVDC3KH/?th=1,7162,15.28,4.70,1019,0.08,0.12,0,0,0,0,2023-04-19,WORKPRO,GreatStar Tools
"Rho Nutrition Liposomal Glutathione - Ultra High Absorption Liquid Glutathione Supplement - Supports Natural Detoxification, Immune System, Skin Health, Mental Clarity & Overall Well-Being",B0BQ3ZNK64,https://www.amazon.com/dp/B0BQ3ZNK64/?th=1,4468,52.95,4.20,109,0.04,0,0.72,0,0,0,2024-01-13,Rho Nutrition,Rho Nutrition
"ZALL Grey Waffle Bath Mat,Super Absorbent Non Slip Bathroom Rug,Gray 18x30inch,Machine Washable Ultra Soft Floor Mats",B0CQY767P8,https://www.amazon.com/dp/B0CQY767P8/?th=1,3820,15.84,4.30,389,0.01,0.02,0,0,0,0,2024-02-18,ZALL,Woot
"Grounding Sheets King Deep Pocket Organic Cotton With Silver Fiber, Earth Fitted Sheet With Cord (Placid Blue, King - 76'x80'x15')",B0DHTVJV9P,https://www.amazon.com/dp/B0DHTVJV9P/?th=1,2995,75.59,4.60,217,0.03,0,0.48,0,0,0,2024-11-21,PANBMAO,Health Grounding
"Grounding Sheets Queen Deep Pocket Organic Cotton with Silver Fiber, Grounding Fitted Earth Sheets with Grounding Cord (Beige, Queen - 60'x80'x15')",B0F3JDT1L8,https://www.amazon.com/dp/B0F3JDT1L8/?th=1,2995,69.59,4.70,205,0.48,0.16,5.73,0,9.80,0,2025-04-03,PANBMAO,"Junan Shengwang Co., Ltd"
"Grounding Sheets King Deep Pocket Organic Cotton with Silver Fiber, Grounding Fitted Earth Sheets with Grounding Cord (Deep Gray, King - 76“x80“x15“) Sleep Well",B0F3P3VW5L,https://www.amazon.com/dp/B0F3P3VW5L/?th=1,2995,75.59,4.70,205,0.23,0,4.30,0,0,0,2025-04-04,PANBMAO,"Junan Shengwang Co., Ltd"
"LAVEVE 3FT x 100FT Weed Barrier Landscape Fabric, 3.2oz Premium Heavy Duty Garden Cloth, Ground Cover for Gardening, Farming with 20 U-Shaped Securing Pegs",B09YTS53S8,https://www.amazon.com/dp/B09YTS53S8/?th=1,2963,28.99,4.40,837,0.05,0.08,0,0,0,0,2022-06-14,LAVEVE,KIP-US
"Nation Health MD Lymph MD - Lymphatic System Supplement with 9 Botanicals - Dandelion, Burdock, Echinacea, Lemon & More - Supplements for Men and Women - 60 Capsules",B0D5BNCPPZ,https://www.amazon.com/dp/B0D5BNCPPZ/?th=1,2723,53.90,3.80,584,0.01,0,0.24,0,0,0,2024-06-13,NATION HEALTH MD,health4y
"Clostnature Tent Footprint - Waterproof Camping Tarp, Heavy Duty Tent Floor Saver, Ultralight Ground Sheet Mat for Hiking, Backpacking, Hammock, Beach - Storage Bag Included",B07MZ3CL2N,https://www.amazon.com/dp/B07MZ3CL2N/?th=1,2660,17.99,4.60,1800,0.04,0.06,0,0,0,0,2019-03-15,Clostnature,Clostnature
"Microwave Heating Pad for Pain Relief, 17' x 9' Microwavable Heating Pads for Cramps, Back Pain, Neck Shoulder, Muscles, Knee, Joints, Natural Heat Pack Moist Heat, Black Cat",B0BCFHY2LQ,https://www.amazon.com/dp/B0BCFHY2LQ/?th=1,2363,17.69,4.70,3309,0.05,0,0,0.19,0,0,2022-08-30,Cuckool,SESDERM
"Grounding Mat for Bed, Grounding Pad for Sleeping, Tear-Resistant PU Leather Grounding Mattress with Cord (27'x76', King, Charcoal)",B0DJ26HLRB,https://www.amazon.com/dp/B0DJ26HLRB/?th=1,2112,35.99,4.40,530,0.49,0.55,0,0.46,0,0,2024-11-07,groundingx,LavenderDream
"Grounding Mat for Bed, Grounding Pad for Sleeping, Tear-Resistant PU Leather Grounding Mattress with Cord (27'x60', Queen, Charcoal)",B0F32TBHBX,https://www.amazon.com/dp/B0F32TBHBX/?th=1,2112,35.99,4.40,530,0.17,0.18,0,0.19,0,0,2025-04-01,groundingx,LavenderDream
"Grounding Sheet, 90% Organic Cotton+10% Pure Silver Organic Fitted Grounded Sheet for Improved Sleep, Pain Relief - Earth Connected Bedding (Gray, (60.3 * 80 * 15.5inch))",B0DRNC5334,https://www.amazon.com/dp/B0DRNC5334/?th=1,1955,--,4.80,93,0.05,0.08,0,0,0,0,2025-04-11,HLLBLL,N/A
"6x300FT Weed Barrier Landscape Fabric Heavy Duty, 3.2oz Woven Geotextile Fabric, Ground Cover Weed Block Gardening Mat, Weed Control Garden Cloth for Driveway,Road,French Drain,Vegetable Patch",B0DQG2XJ8X,https://www.amazon.com/dp/B0DQG2XJ8X/?th=1,1861,87.99,4.40,107,0.01,0.02,0,0,0,0,2025-02-21,PALATALA,FHY20
Red Light Therapy for Body:5 Light Levels Infrared Light Heat Therapy Belt Wrap for Back/Waist/Muscle/Pain Relief 660nm & 850nm Led Beads Red Light Therapy Device with Timer,B0DQ19MLK7,https://www.amazon.com/dp/B0DQ19MLK7/?th=1,1743,33.99,4.40,113,0.01,0,0,0,1.96,0,2024-12-30,RAYOCON,Rayocon direct
"Red Light Therapy Mat for Body, 71'x 31' Red Light Therapy Blanket Red Near Infrared 660nm 850nm Full Body Pad, 1280 LEDs Infrared Light Therapy for Body for Pain Relief, Improved Sleep",B0CNX7WVX6,https://www.amazon.com/dp/B0CNX7WVX6/?th=1,1738,389.98,4.50,140,0.01,0,0,0,1.96,0,2023-11-27,GMOWNW,GMOWNW YY
Earth Grounding Fitted Sheet King Size Gray with 12% Silver Fiber & 4% Silk & 84% Organic Cotton - Gray - Soft Earth Grounding Well Bed Sheets - Grounded Conductive Bed Sheets for Better Sleep,B0CVGSSP4L,https://www.amazon.com/dp/B0CVGSSP4L/?th=1,1599,169.96,4.10,559,0.01,0,0,0.05,0,0,2024-02-12,ECOHEAL,SILVER LINE LLC
Earth Grounding Fitted Sheet King Size with 12% Silver Fiber & 4% Silk & 84% Organic Cotton - Black - Soft Earth Grounding Well Bed Sheets - Grounded Conductive Bed Sheets for Better Sleep,B0DPGLMCSY,https://www.amazon.com/dp/B0DPGLMCSY/?th=1,1599,139.96,4.20,512,0.01,0,0,0.05,0,0,2024-12-02,ECOHEAL,SILVER LINE LLC
"Grounding Sheets King, 90% Organic Cotton+ 10% Pure Silver Fiber,Grounded Bed Sheet Kit, Deep Pocket Grounded Bed Sheet, Relieves Pain - Used for Healthy Sleep Therapy (Gray, King)",B0DRW7R9RG,https://www.amazon.com/dp/B0DRW7R9RG/?th=1,1564,94.99,4.40,47,0.01,0,0,0.05,0,0,2025-01-12,Sayorg,lan zhi jiao yu
"Grounding Sheets King, 90% Organic Cotton+ 10% Pure Silver Fiber,Grounded Bed Sheet Kit, Deep Pocket Grounded Bed Sheet, Relieves Pain - Used for Healthy Sleep Therapy (Gray, Full)",B0DRW5F9SR,https://www.amazon.com/dp/B0DRW5F9SR/?th=1,1564,71.99,4.40,47,0.05,0,0,0.19,0,0,2025-01-17,Sayorg,lan zhi jiao yu
"Grounding Mat, Grounding Mat for Bed with Grounding Cord, Soft PU Leather Grounding Sleep Mat, Grounding Mat for Better Sleep, Pain and Stress Relief (27x78inch)",B0DS2G6PF1,https://www.amazon.com/dp/B0DS2G6PF1/?th=1,1536,38.59,4.30,27,0.27,0.23,0,0.42,0,0,2025-02-12,CAIGAEUO,XUANWEN
"Grounding Mat, Grounding Mat for Bed with Grounding Cord, Soft PU Leather Grounding Sleep Mat, Grounding Mat for Better Sleep, Pain and Stress Relief (54x78inch)",B0DS2CYDRT,https://www.amazon.com/dp/B0DS2CYDRT/?th=1,1536,61.99,4.30,28,0.71,0.47,0,1.44,0,0,2025-01-23,CAIGAEUO,XUANWEN
"Grounding Mat for Bed 90% Organic Cotton+10% Pure Silver Fiber, Grounding Fitted Sheets for All Mattress Sizes, with Static grounding Cord and Test Pen (White, 105.5 * 23.5 inch)",B0F1DKMV8R,https://www.amazon.com/dp/B0F1DKMV8R/?th=1,1450,20.00,1.00,2,0.05,0.08,0,0,0,0,2025-04-23,TWK,TWK-US
"Grounding Mat for Bed with Leather, Improve Sleep, Relieve Stress & Pain, Anti-Slip & Eco-Friendly PU Leather, Includes Grounding Cord & Sleep Mask for Enhanced Rest(Queen-27’’×60’’)",B0DSLB35ZD,https://www.amazon.com/dp/B0DSLB35ZD/?th=1,1349,--,4.20,91,0.15,0.12,0,0.28,0,0,2025-03-11,IKNUH,N/A
"Grounding Mat for Bed with Leather, Improve Sleep, Relieve Stress & Pain, Anti-Slip & Eco-Friendly PU Leather, Includes Grounding Cord & Sleep Mask for Enhanced Rest(King-27’’×78’’)",B0DSLB5R1J,https://www.amazon.com/dp/B0DSLB5R1J/?th=1,1322,--,3.80,30,0.18,0.27,0,0,0,0,2025-03-11,IKNUH,N/A
"Grounding Mat for Bed 90% Organic Cotton+10% Pure Silver Fiber, Grounding Fitted Sheets for All Mattress Sizes, with Static grounding Cord and Test Pen (Gray, 105.6 * 23.6 inch)",B0F1DGRG63,https://www.amazon.com/dp/B0F1DGRG63/?th=1,1247,20.00,4.80,83,0.04,0.06,0,0,0,0,2025-04-17,TWK,TWK-US
"Grounding Mat for Bed 90% Organic Cotton+10% Pure Silver Fiber, Grounding Fitted Sheets for All Mattress Sizes, with Static grounding Cord and Test Pen (Gray, 105.3 * 23.4 inch)",B0F21DB9YM,https://www.amazon.com/dp/B0F21DB9YM/?th=1,1247,20.00,4.80,88,0.18,0.27,0,0,0,0,2025-05-02,TWK,TWK-US
"Grounding Mat for Bed 90% Organic Cotton+10% Pure Silver Fiber, Grounding Fitted Sheets for All Mattress Sizes, with Static grounding Cord and Test Pen (White, 105.2 * 23.4 inch)",B0F2NBGS37,https://www.amazon.com/dp/B0F2NBGS37/?th=1,1247,36.99,4.80,88,0.12,0.18,0,0,0,0,--,TWK,TWK-US
"Grounding Mat for Bed 90% Organic Cotton+10% Pure Silver Fiber, Grounding Fitted Sheets for All Mattress Sizes, with Static grounding Cord and Test Pen (Gray, 105.1 * 23.3 inch)",B0F3CZ6967,https://www.amazon.com/dp/B0F3CZ6967/?th=1,1247,20.00,4.80,88,0.04,0.04,0,0.05,0,0,--,TWK,TWK-US
26.8' x 26.8' Plant Repotting Mat Waterproof Transplanting Mat Indoor Succulent Potting Mat Portable Gardening Watering mat Square and Foldable Garden mat,B09PBGLB4Z,https://www.amazon.com/dp/B09PBGLB4Z/?th=1,1149,4.99,4.70,692,0.12,0.18,0,0,0,0,2022-02-08,WondMall,IntegrityMall
"OZUBEEL Grounding Sheets, Grounding Mat for Bed Earth Grounded Sheet Pad 10% Silver Fiber+90% Organic Cotton, for Queen, King and All Mattress Sizes, with Outlet Tester & Cord 104”*24” (White)",B0DR23Q52N,https://www.amazon.com/dp/B0DR23Q52N/?th=1,1106,21.99,4.40,194,0.04,0.06,0,0,0,0,2025-01-02,OZUBEEL,OZUBEEL Shop
"Grounding Sheets, Grounding Mat for Bed Earth Grounded Sheet Pad 10% Silver Fiber+90% Organic Cotton, for Queen, King and All Mattress Sizes, with Outlet Tester & Cord 104'*24' (Smoky Grey)",B0DTP2Y44D,https://www.amazon.com/dp/B0DTP2Y44D/?th=1,1106,18.69,4.20,254,0.54,0.60,0,0.42,3.92,0,2025-03-18,OZUBEEL,OZUBEEL Shop
"Grounding Mat for Bed, Grounding Pad for Sleep, Anti-Slip PU Leather Grounding Mattress with Grounding Cord, 27’’×39‘’, Twin",B0D6VFQ734,https://www.amazon.com/dp/B0D6VFQ734/?th=1,1004,27.99,3.90,579,0.05,0,0,0.19,0,0,2024-06-12,Dragsui,EudoreGAM
"Grounding Mat for Bed, Grounding Pad for Sleep, Anti-Slip PU Leather Grounding Mattress with Grounding Cord, 27’’×76‘’, King",B0D6VQTDN7,https://www.amazon.com/dp/B0D6VQTDN7/?th=1,1004,45.49,3.90,579,0.22,0.21,0,0.28,0,0,2024-06-25,Dragsui,EudoreGAM
"Grounding Mat for Bed, Grounding Pad for Sleep, Anti-Slip PU Leather Grounding Mattress with Grounding Cord, 27’’×60‘’, Queen",B0D6VMGVFZ,https://www.amazon.com/dp/B0D6VMGVFZ/?th=1,1004,34.99,3.90,583,0.45,0.47,0,0.51,0,0,2024-06-17,Dragsui,EudoreGAM
"Grounding Mat for Bed, Grounded Pad for Sleep, Anti-Slip PU Leather Grounded Mat with Grounding Cord, 27’’×39‘’, Twin",B0DZNFXH4X,https://www.amazon.com/dp/B0DZNFXH4X/?th=1,986,34.99,3.40,29,0.05,0,0,0.19,0,0,2025-04-02,Dragsui,DuneyrrToy
"Grounding Mat for Bed, Grounded Pad for Sleep, Anti-Slip PU Leather Grounded Mat with Grounding Cord, 27’’×76‘’, King",B0DY4RG9GV,https://www.amazon.com/dp/B0DY4RG9GV/?th=1,986,53.19,3.40,29,0.01,0.02,0,0,0,0,2025-04-04,Dragsui,DuneyrrToy
"Grounding Mat for Bed, Grounded Pad for Sleep, Anti-Slip PU Leather Grounded Mat with Grounding Cord, 27’’×54‘’, Full",B0DZN2LFT7,https://www.amazon.com/dp/B0DZN2LFT7/?th=1,986,41.99,3.40,29,0.05,0,0,0.19,0,0,2025-03-07,Dragsui,DuneyrrToy
"Earth and Moon Grounding Mat for Bed 24x35in - Full Body Grounding Pad and Mattress Cover for Pain, Inflammation and Restful Sleep, Includes 15 Feet Cord and Outlet Tester for Safe Use",B07F76MFBP,https://www.amazon.com/dp/B07F76MFBP/?th=1,976,69.99,4.20,2225,0.45,0.16,4.06,0.19,11.76,0,2019-02-01,EARTH AND MOON,Earth and Moon
"Earth and Moon Grounding Mat for Desk, Reduce Fatigue & Stress, Supports Energy & Wellness, Grounding Pad for Bed, Office, Living Room, Works Well w/Sheets, Blanket, w/ 15 Foot Cord, 35x24in, 2 Pack",B09LJQFQK4,https://www.amazon.com/dp/B09LJQFQK4/?th=1,976,109.99,4.20,2216,0.09,0.14,0,0,0,0,2021-11-11,EARTH AND MOON,Earth and Moon
"Grounding Mat for Feet (13x29in) C Earth Connected Wellness for Pain Relief, Muscle Tension & Relaxation C Travel Size Grounding Pad with Outlet Tester by Earth and Moon",B0C3JD6W81,https://www.amazon.com/dp/B0C3JD6W81/?th=1,976,34.99,4.20,2225,0.43,0.64,0,0,0,0,2023-05-25,EARTH AND MOON,Earth and Moon
Grounding Mat,B0CP39ZHMY,https://www.amazon.com/dp/B0CP39ZHMY/?th=1,944,69.00,3.80,168,0.74,0.64,2.39,0.65,0,0,2023-12-07,GroundingWell,WellGrounded
"Grounding Sheets C Grounding Mat for Bed, 10% Silver Fiber Grounded Fitted Bed Earth Sheets for All Mattress Sizes, Includes Grounding Cord (White)",B0DTHRFXK8,https://www.amazon.com/dp/B0DTHRFXK8/?th=1,940,39.99,4.30,69,0.39,0.58,0,0,0,0,2025-01-23,MCZAROA,MCZAROA?
"Grounding Sheets C Grounding Mat for Bed, 10% Silver Fiber Grounded Fitted Bed Earth Sheets for All Mattress Sizes, Includes Grounding Cord (Deep Gray)",B0DTHW4DNF,https://www.amazon.com/dp/B0DTHW4DNF/?th=1,940,39.99,4.30,69,0.01,0.02,0,0,0,0,2025-01-22,MCZAROA,MCZAROA?
"Grounding Mat for Bed King, Queen, Full Size, for Sleeping Improvement, Muscle Relaxation, Earthing Pad for Feet, Mats for Desk, Earth, Pads for Bedding, Wellness Gift",B0DH79MDVD,https://www.amazon.com/dp/B0DH79MDVD/?th=1,884,49.99,4.10,143,0.74,0.66,3.10,0.46,0,0,2024-09-22,GAYA,GAYA LIVING LLC
"Grounding Mat for Bed King, Queen, Full Size, for Sleeping Improvement, Muscle Relaxation, Earthing Pad for Feet, Mats for Desk, Earth, Pads for Bedding, Wellness Gift",B0DH79WW6X,https://www.amazon.com/dp/B0DH79WW6X/?th=1,884,47.49,4.10,139,0.01,0,0,0.05,0,0,2024-09-22,GAYA,GAYA LIVING LLC
"Grounding Mat for Bed King, Queen, Full Size, for Sleeping Improvement, Muscle Relaxation, Earthing Pad for Feet, Mats for Desk, Earth, Pads for Bedding, Wellness Gift",B0DS7Z1C33,https://www.amazon.com/dp/B0DS7Z1C33/?th=1,884,44.99,4.10,134,0.13,0,0,0.46,0,0,2025-02-28,GAYA,GAYA LIVING LLC
"Yoga Steet Grounding Mat, Foot Therapy, 35.4x23.6 inches Grounding Pad for Bed, Boost Energy, Improve Sleep, Reduce Anxiety - Reconnect to Nature with Our Grounding Mat",B0D2RG4Z2S,https://www.amazon.com/dp/B0D2RG4Z2S/?th=1,883,17.99,4.00,215,0.48,0.64,0,0.19,0,0,2024-08-20,SORSWEET,SORSWEET
"Grounding Pads, Anti-Slip PU Leather, Grounding Mat Improves Sleep, relieves Stress, with Static grounding Cord and Test Pen (Black, (60.2 * 27 inch))",B0F21KZD2J,https://www.amazon.com/dp/B0F21KZD2J/?th=1,857,35.00,5.00,66,0.21,0.31,0,0,0,0,2025-05-03,TWK,TWK-US
"Grounding Mattress Pads, Anti-Slip PU Leather, Grounding Mat Improves Sleep, relieves Stress, with Static grounding Cord and Test Pen (Black, (76.1 * 27.2 inch))",B0F21L1VFV,https://www.amazon.com/dp/B0F21L1VFV/?th=1,857,79.99,5.00,66,0.08,0,0,0.28,0,0,--,TWK,TWK-US
"Grounding Mat for Bed, Grounded Pad for Sleep, Anti-Slip PU Leather Grounded Mat with Grounding Cord, 27’’×72‘’, California King",B0DZX3Z1YV,https://www.amazon.com/dp/B0DZX3Z1YV/?th=1,845,69.99,5.00,72,0.08,0.12,0,0,0,0,2025-03-10,Dragsui,DuneyrrToy
"Grounding Mat for Bed, Grounded Pad for Sleep, Anti-Slip PU Leather Grounded Mat with Grounding Cord, 27’’×54‘’",B0F8BNGV35,https://www.amazon.com/dp/B0F8BNGV35/?th=1,845,41.99,5.00,71,0.22,0,0,0.79,0,0,--,Dragsui,DuneyrrToy
"Grounding Mat for Bed, Grounded Pad for Sleep, Anti-Slip PU Leather Grounded Mat with Grounding Cord, 27’’×60‘’",B0F8BLY3YF,https://www.amazon.com/dp/B0F8BLY3YF/?th=1,845,59.99,5.00,72,0.05,0,0,0.19,0,0,2025-05-15,Dragsui,DuneyrrToy
"Grounding Mat for Bed, Grounded Pad for Sleep, Anti-Slip PU Leather Grounded Mat with Grounding Cord, 27‘‘×76‘’",B0F8HJMS7Z,https://www.amazon.com/dp/B0F8HJMS7Z/?th=1,845,53.19,5.00,72,0.09,0.06,0,0.19,0,0,2025-05-13,Dragsui,DuneyrrToy
"Grounding Mat for Bed, Grounded Pad for Sleep, Anti-Slip PU Leather Grounded Mat with Grounding Cord, 27’’×39‘’",B0F8BMNZSK,https://www.amazon.com/dp/B0F8BMNZSK/?th=1,845,34.99,5.00,72,0.17,0.14,0,0.28,0,0,2025-05-12,Dragsui,DuneyrrToy
"Grounding Mat for Feet, Sleep Improvement, Back Pain Relief, Muscle Relaxation & Stress, Earthing Pads for Bed, Ground for Desk, Earth Mats, Bedding Pad (24’’X16’’)",B0D83XBTXV,https://www.amazon.com/dp/B0D83XBTXV/?th=1,824,39.99,4.30,247,0.76,0.51,3.82,0.79,0,0,2024-07-22,GAYA,GAYA LIVING LLC
"Grounding Mat for Feet, Sleep Improvement, Back Pain Relief, Muscle Relaxation & Stress, Earthing Pads for Bed, Ground for Desk, Earth Mats, Bedding Pad (24’’X16’’)",B0D846VMP2,https://www.amazon.com/dp/B0D846VMP2/?th=1,824,39.99,4.30,244,0.04,0.04,0.24,0,0,0,2024-07-18,GAYA,GAYA LIVING LLC
"Grounding Mat for Feet, Sleep Improvement, Back Pain Relief, Muscle Relaxation & Stress, Earthing Pads for Bed, Ground for Desk, Earth Mats, Bedding Pad (24’’X16’’)",B0DFGZCG8N,https://www.amazon.com/dp/B0DFGZCG8N/?th=1,824,39.99,4.30,246,0.13,0,0.72,0.33,0,0,2024-09-22,GAYA,GAYA LIVING LLC
"Grounding Mat for Feet, Sleep Improvement, Back Pain Relief, Muscle Relaxation & Stress, Earthing Pads for Bed, Ground for Desk, Earth Mats, Bedding Pad (24’’X16’’)",B0DFGYMZD6,https://www.amazon.com/dp/B0DFGYMZD6/?th=1,824,39.99,4.30,246,0.27,0.08,0.48,0.70,0,0,2024-10-01,GAYA,GAYA LIVING LLC
"Grounding Mat for Feet, Sleep Improvement, Back Pain Relief, Muscle Relaxation & Stress, Earthing Pads for Bed, Ground for Desk, Earth Mats, Bedding Pad (24’’X16’’)",B0DSV544FB,https://www.amazon.com/dp/B0DSV544FB/?th=1,824,39.99,4.70,7,0.05,0.08,0,0,0,0,2025-03-30,GAYA,GAYA LIVING LLC
"Grounding Mat for Improved Sleep, Reduced Anxiety, Pain, Inflammation, Headache Relief, Balance. Grounded Therapy- (Black, (72.1 * 54inch))",B0DSSQXMPG,https://www.amazon.com/dp/B0DSSQXMPG/?th=1,784,45.00,5.00,56,0.01,0.02,0,0,0,0,2025-02-21,HLLBLL,Luonavei-US
"Grounding Mat for Improved Sleep, Reduced Anxiety, Pain, Inflammation, Headache Relief, Balance. Grounded Therapy-(Black, (60.3 * 27.4inch))",B0DSLKXSSG,https://www.amazon.com/dp/B0DSLKXSSG/?th=1,784,35.00,4.80,65,0.05,0,0,0.19,0,0,2025-04-01,HLLBLL,Luonavei-US
"Grounding Mat for Improved Sleep, Reduced Anxiety, Pain, Inflammation, Headache Relief, Balance. Grounded Therapy- (Black, (39.2 * 27.5inch))",B0DZ6G66ZL,https://www.amazon.com/dp/B0DZ6G66ZL/?th=1,784,20.00,5.00,64,0.18,0.27,0,0,0,0,2025-04-09,HLLBLL,Luonavei-US
"Grounding Mat for Improved Sleep, Reduced Anxiety, Pain, Inflammation, Headache Relief, Balance. Grounded Therapy- (Black, (39.2 * 27.5inch))",B0DSLQ6CJX,https://www.amazon.com/dp/B0DSLQ6CJX/?th=1,784,39.99,5.00,66,0.03,0,0,0.09,0,0,2025-05-03,HLLBLL,Luonavei-US
