产品名称,ASIN,URL,Listing月销量,实际价格( $ ),评分星级,评价数量,曝光占比,曝光占比,曝光占比,曝光占比,曝光占比,曝光占比,上架时间,品牌,卖家
"Grounding Mat for Improving Sleep, Grounding Pad for Health, Grounding Bed Mat with Grounding Cord for Better Working (35.5 * 23.6inch)",B0BMYK13VQ,https://www.amazon.com/dp/B0BMYK13VQ/?th=1,212,18.44,4.00,371,0.31,0.35,0,0.28,0,0,2022-12-02,VAJOOCLL,baixundianzi
"CONDUCTIVE Brand Grounding Flat Bed Sheet with Grounded Connection Cable (52 x 27 inch, Grey Color) User for Wellness Benefits Sleep",B08LYV8SQ7,https://www.amazon.com/dp/B08LYV8SQ7/?th=1,204,19.99,4.10,192,0.06,0,0,0.23,0,0,2020-12-08,CONDUCTIVE,EMF Shielding
"CONDUCTIVE Brand Grounding Flat Bed Sheet with Grounded Connection Cable （ 80 x 60 inch, Grey Color ） User for Wellness Benefits Sleep",B08LYG9NNY,https://www.amazon.com/dp/B08LYG9NNY/?th=1,204,32.99,4.10,192,0.08,0,0,0.28,0,0,2020-12-31,CONDUCTIVE,EMF Shielding
"Grounding Sheets, Grounding Mat for Bed, Earth Connected Grounding Sheets, ZORERRY 10% Silver Fiber+90% Cotton Grounded Sheet Mat 24'*104' (Charcoal Grey)",B0DWFFJ667,https://www.amazon.com/dp/B0DWFFJ667/?th=1,199,25.49,4.50,62,0.21,0.27,0,0.09,0,0,2025-02-23,ZORERRY,BLBli
"Grounding Mat for Sleep, Energy, Pain Relief, Inflammation, Balance, Wellness. Earth Connected Therapy. Indoor Grounding at Home, Office, Work. 15 Foot Cord Included. Conductive Carbon",B0DMZWXSTD,https://www.amazon.com/dp/B0DMZWXSTD/?th=1,195,18.94,4.70,15,0.49,0.64,0,0.23,0,0,2024-12-24,SORSWEET,SORSWEET
"Grounding Mat 24'x16' with Conductivity Tester for Conductive Carbon Used for Pain Relief, Improved Sleep and Wellness with 17-Foot Cord - Non-Slip Earthing Mat for Home, Office, and Gym by ZenOasis",B0D88BG7YR,https://www.amazon.com/dp/B0D88BG7YR/?th=1,193,19.99,3.80,136,0.70,0.68,0,0.88,0,0,2024-06-30,ZEN OASIS,ZEN-OASIS
"LandKissing? Grounding Mats 24'x16' (2 Pack) for Grounding Therapy, Grounding Mat Kit for Improved Sleep, Lower Anxiety, Inflammation,Benefit Grouding Kit with Adapter Splitter, Grounding Tester",B0DDXVQP4C,https://www.amazon.com/dp/B0DDXVQP4C/?th=1,192,63.99,4.60,26,0.53,0.64,0,0.37,0,0,2024-08-30,LandKissing,"New Earth Industrial CO., Limited"
"Grounding Mat for Improved Sleep, Reduced Anxiety, Pain, Inflammation, Headache Relief, Balance. Grounded Therapy- (Black, (72.3 * 54inch))",B0F224MY4P,https://www.amazon.com/dp/B0F224MY4P/?th=1,186,49.50,1.00,2,0.09,0.14,0,0,0,0,2025-05-03,HLLBLL,Luonavei-US
"Grounding Mat Kit, Breathing Grounding Mats for Bed Ground Cord Grounding Products for Efficient Sleep, Reduce Stress Sleeping Sheet Pad (54x78IN)",B09XQ75K19,https://www.amazon.com/dp/B09XQ75K19/?th=1,179,70.26,4.10,164,0.37,0.49,0,0.19,0,0,2022-05-09,KLASLAV,zhifandianzicailiao
"Grounding Mat for Bed, Grounding Mattress Cover for Improving Sleep, Sleep Pad, Earth Mat Carbon Leatherette Therapy (27' x 78')",B0C616L4W9,https://www.amazon.com/dp/B0C616L4W9/?th=1,178,51.33,3.80,171,0.39,0.58,0,0,0,0,2023-07-18,EOHELGRO,fengdinong
"Grounding Mat for Bed, Grounding Mattress Cover for Improving Sleep, Sleep Pad, Earth Mat Carbon Leatherette Therapy (54' x 78')",B0C616J9RQ,https://www.amazon.com/dp/B0C616J9RQ/?th=1,178,66.23,3.80,171,0.05,0.06,0,0.05,0,0,2023-07-11,EOHELGRO,fengdinong
"GroundLuxe Premium New Zealand Wool Dryer Balls - 100% Organic, Hand-Felted, Reusable, Reduce Drying Time - Set of 6 for Natural Fabric Softening, Wrinkle & Static Reduction",B0CZG2B3TX,https://www.amazon.com/dp/B0CZG2B3TX/?th=1,174,19.99,4.80,52,0.01,0,0,0.05,0,0,2024-11-18,GroundLuxe,GroundLuxe
"GAYA Grounding Tester Earthing for Grounding Products, Electric Outlet Testing Plug in, GFCI Test, Receptacle and Plug Testers, Circuit, Ground, GFCI Outlet, Socket Power Check",B0D847G2QT,https://www.amazon.com/dp/B0D847G2QT/?th=1,173,9.99,4.40,95,0.17,0,3.10,0,0,0,2024-07-28,GAYA,GAYA LIVING LLC
"Grounding Mat for Sleeping, Earth Mat Grounding Pad for Energy, Pain Relief, Inflammation, Feet and Back Pain(23.6' x 11.8')",B0C33MHC9H,https://www.amazon.com/dp/B0C33MHC9H/?th=1,171,12.47,4.00,108,0.15,0.12,0,0.28,0,0,2023-05-06,EOHELGRO,fengdinong
"Grounding Mat Kit 35.4 x 23.6 Inches, Grounding Mat for Sleep, Energy, Pain Relief, Inflammation, Balance, Wellness.",B0C611RBVV,https://www.amazon.com/dp/B0C611RBVV/?th=1,171,25.19,4.00,70,0.40,0.49,0,0.28,0,0,2023-07-10,EOHELGRO,fengdinong
"Grounding Mat, Grounding Pads for Feet Improved Sleep Energy Health, Upgraded Non-Slip Conductive Pad for Sleeping, Earth Connected Mats for Bed Desk Home Office(24'x16')",B0CXSQS5NP,https://www.amazon.com/dp/B0CXSQS5NP/?th=1,168,22.79,3.90,208,1.03,0.78,4.53,0.51,19.61,0,2024-03-12,Merisky,Merisky Direct
"Grounding Mat Earth Pad Grounded Feet Mat 23.6x35.4 Inch Grounding Mat for Desk Floor with Cord Better Sleep,Balance",B0CYPSVFHK,https://www.amazon.com/dp/B0CYPSVFHK/?th=1,167,20.79,4.30,59,0.54,0.51,0,0.74,0,0,2024-04-13,LAXVAPIU,MAOKE
"Grounding Mat Foot Pad Grounded Mats 11.8x23.6 Inch Grounding Mat for Desk Laptop with Cord Better Sleep,Balance",B0CYPJPXCR,https://www.amazon.com/dp/B0CYPJPXCR/?th=1,167,16.79,4.30,59,0.14,0.18,0,0.09,0,0,2024-04-12,LAXVAPIU,MAOKE
"Grounding Pad, Anti-Slip PU Leather, Grounding Mat Improves Sleep, relieves Stress, with Static grounding Cord and Test Pen (Black, (72 * 54.5 inch))",B0DKY5TW5R,https://www.amazon.com/dp/B0DKY5TW5R/?th=1,166,44.50,2.00,2,0.34,0.51,0,0,0,0,2025-04-01,TWK,TWK-US
"Grounding Mat, Grounding Pad for Sleeping 11.8x23.6 Inches with 15 Feet Grounding Cord, Improve Sleep, Help with Anxiety, Earth Mat at Home, Work",B0D3DN7BXR,https://www.amazon.com/dp/B0D3DN7BXR/?th=1,163,17.10,4.10,175,0.63,0.66,0,0.70,0,0,2024-05-26,MIUQAOKL,MIUQAOKL
"Grounding Mat, Grounding Pad for Sleeping 23.6x35.4 Inches with 15 Feet Grounding Cord, Improve Sleep, Help with Anxiety, Earth Mat at Home, Work",B0D3DFJFYH,https://www.amazon.com/dp/B0D3DFJFYH/?th=1,163,21.15,4.10,174,0.12,0.02,0,0.37,0,0,2024-06-21,MIUQAOKL,MIUQAOKL
"Grounding Mat for Bed, Grounding Pad for Sleeping, Anti-Slip PU Leather Mattress Earthing Mat with Cord for Better Sleep, Pain and Stress Relief, 27.5’’×76‘’, King",B0DLBPJBR3,https://www.amazon.com/dp/B0DLBPJBR3/?th=1,159,45.99,4.00,38,0.54,0.64,0,0.42,0,0,2024-11-13,PODYSLEN,Xindfyu
"Grounding Mat for Bed, Grounding Pad for Sleeping, Anti-Slip PU Leather Grounding Mattress Earthing Mat Grounding Pad with Grounding Cord for Better Sleep, Pain and Stress Relief, 27.5’’×60‘’, Queen",B0DS5PX3Q2,https://www.amazon.com/dp/B0DS5PX3Q2/?th=1,159,39.99,4.00,38,0.04,0.02,0,0.09,0,0,2025-02-17,PODYSLEN,Xindfyu
Grounding Blanket - Soft Cozy Earth Connected Fleece Throw for Relaxation - 5’x4’,B0DSFRXFC6,https://www.amazon.com/dp/B0DSFRXFC6/?th=1,151,54.00,4.40,16,0.05,0,0,0.19,0,0,2025-02-12,HEAL NATURALLY,Vision Chasers
"Grounding Sheets, 10% Silver Grounding Bed Sheets, 90% Organic Cotton Grounded 400 Threads Connected Bedding, Deep Pocket Fitted Earth Sheets with Grounding Tester - [King 76'x 80'x 15', Off White]",B0DSDGG6TM,https://www.amazon.com/dp/B0DSDGG6TM/?th=1,150,65.46,4.30,85,0.03,0,0.24,0.05,0,0,2025-01-30,KUREZEL,KUREZEL-US
"Grounding Sheets, 10% Silver Fiber Grounding Sheets, Grounded Bed Sheets Connected Bedding Fitted Earth Sheets [King 76“x 80“x 15“, Navy Blue]",B0DQ8D658L,https://www.amazon.com/dp/B0DQ8D658L/?th=1,150,119.99,4.30,130,0.01,0,0.24,0,0,0,2025-02-25,KUREZEL,KUREZEL-US
"Grounding Sheets, 10% Silver Fiber Grounding Sheets, Grounded Bed Sheets Connected Bedding Fitted Earth Sheets [King 76'x 80'x 15', Obsidian Black]",B0DQ8HD9WC,https://www.amazon.com/dp/B0DQ8HD9WC/?th=1,150,55.27,4.30,86,0.01,0,0.24,0,0,0,2025-02-19,KUREZEL,KUREZEL-US
"Aura? Luxury Grounding Sheets King Size, 12% Pure Silver - Highest Silver Content Available - Grounding Bed Sheets - Grounded Sheets King Size - 78' x 80' x 15' - Gray, Fitted",B0DL6ZWHXV,https://www.amazon.com/dp/B0DL6ZWHXV/?th=1,147,179.99,4.30,16,0.13,0,0,0.46,0,0,2024-10-28,Aura,Day Moon Designs
"Grounding Blanket for Improved Sleep, Relax, Grounding Bed Throw Blanket, Earth Connect Bedding Sheet(Beige, 60'x80')",B0DHXKHCMN,https://www.amazon.com/dp/B0DHXKHCMN/?th=1,145,67.70,4.70,19,0.01,0,0,0.05,0,0,2024-09-25,EOHELGRO,fengdinong
"Kangaroo Hoppers Gymnastics Tumbling Mats for Kids, Foldable Gym Mat with Carrying Handles for Home Activity Play",B0BDLBC1MC,https://www.amazon.com/dp/B0BDLBC1MC/?th=1,140,71.99,4.60,129,0.05,0,0.95,0,0,0,2022-09-08,Kangaroo Hoppers,H&amp;L Direct
"Grounding Mat,Conductive Grounding Pad, Universal Grounding Mat for Pain Relief,Earth Therapy for Foot Mat,Computer Mat, Sleep Mat,Grounding Mat Kit",B0DK889VTC,https://www.amazon.com/dp/B0DK889VTC/?th=1,140,22.99,4.20,44,0.03,0.04,0,0,0,0,2024-11-21,YRSHJJA,"Dongguan Yurui Home Furnishings Co., Ltd"
"Grounding Mat,Grounding Wrist Strap,Relieve Pain, Improve Sleep, Eliminate Inflam Mation Bioelectric Balance Mattress,with Grounding Wire,Suitable for Home and Office Use",B0DK898Z1S,https://www.amazon.com/dp/B0DK898Z1S/?th=1,140,17.99,4.10,42,0.46,0.64,0,0.14,0,0,2024-11-21,YRSHJJA,"Dongguan Yurui Home Furnishings Co., Ltd"
"ZenEarth Grounding Wire, Universal Grounding Cable Compatible with Earthing Accessories such as Grounding Sheets, Mats, Pillowcases & More. The Grounding Cord is 15.3ft ULTRA-THIN. (Grounding Cord)",B0D2SVQWK8,https://www.amazon.com/dp/B0D2SVQWK8/?th=1,139,11.77,4.50,31,0.01,0,0,0.05,0,0,2024-05-28,STEVENS PARRA,ZenEarth Life
"Grounding Mat Cotton Grounded Pad Silver Fiber Earth Connected Mat for Bed (24'x 36',Beige) Improves Sleep, Promotes Circulation",B0DH21GDJK,https://www.amazon.com/dp/B0DH21GDJK/?th=1,139,41.39,4.20,21,0.04,0.02,0,0.09,0,0,2024-11-29,XINHUSU,XINHUAI
"Grounding Mat Cotton Grounded Pad Silver Fiber Earth Connected Mat for Bed (35'x 50',Grey) Improves Sleep, Promotes Circulation",B0DH1XKXHG,https://www.amazon.com/dp/B0DH1XKXHG/?th=1,139,57.93,4.20,28,0.06,0.10,0,0,0,0,2024-11-19,XINHUSU,XINHUAI
"Grounding Mat Cotton Grounded Pad Silver Fiber Earth Connected Mat for Bed (24'x 36',Grey) Improves Sleep, Promotes Circulation",B0DH1Y8KJG,https://www.amazon.com/dp/B0DH1Y8KJG/?th=1,139,35.99,4.20,28,0.13,0.12,0,0.19,0,0,2024-11-11,XINHUSU,XINHUAI
"Grounding Mat Cotton Grounded Pad Silver Fiber Earth Connected Mat for Bed (35'x 50',Beige) Improves Sleep, Promotes Circulation",B0DH1SR4FT,https://www.amazon.com/dp/B0DH1SR4FT/?th=1,139,56.69,4.20,28,0.21,0.19,0,0.28,0,0,2024-11-19,XINHUSU,XINHUAI
"Hooga Grounding Mat Kit for Pain Relief, Energy, Sleep, Inflammation, Wellness with Conductive Socks, Adapter, Outlet Tester, Continuity Tester, Extra Grounding Cord",B0CHWNVB45,https://www.amazon.com/dp/B0CHWNVB45/?th=1,134,79.99,4.10,121,0.64,0.53,0,1.07,0,0,2023-10-13,hooga,Hooga Health
"Grounding Mat for Sleep, Energy, Pain Relief, Inflammation, Balance, Wellness. Earth Connected Therapy. Indoor Grounding at Home, Office, Work. 15 Foot Cord Included. Conductive Carbon. 13’’ x 11'",B08FCR34JY,https://www.amazon.com/dp/B08FCR34JY/?th=1,132,19.99,4.40,218,0.43,0.64,0,0,0,0,2020-10-28,hooga,Hooga Health
"Jecanori Grounding Mat for Improves Sleep, 35.4' x 23.6' Earthing Mat Grounding Pad for Feet & Bed, Earth Connected Therapy for Pain Relief, Energy, Inflammation & Wellness",B0DRNXZ7VW,https://www.amazon.com/dp/B0DRNXZ7VW/?th=1,131,21.11,4.40,11,0.32,0.47,0,0.05,0,0,2025-02-13,Jecanori,Jecanori
"Grounding Mat for Bed, Earthing Mat Grounding Pad for Sleeping, Reduced Anxiety, Pain, Inflammation, Headache Relief, Balance, Grounding Mattress Pad with 15 Feet Cord, King Size 74.80'x26.77'",B0DSG27BJQ,https://www.amazon.com/dp/B0DSG27BJQ/?th=1,130,49.99,4.30,30,0.26,0.39,0,0,0,0,2025-03-14,Silkena,Silkena-zsshop
"Grounding Mat for Bed, Earthing Mat Grounding Pad for Sleeping, Reduced Anxiety, Pain, Inflammation, Headache Relief, Balance, Grounding Mattress Pad with 15 Feet Cord, Queen Size 59.06'x26.77'",B0DSG19WYF,https://www.amazon.com/dp/B0DSG19WYF/?th=1,130,41.99,4.30,30,0.27,0.35,0,0.14,0,0,2025-02-25,Silkena,Silkena-zsshop
"Grounding Mat for Feet - Foldable Earthing Grounding Mat for Bed with Tester Pen & Cord - Lightweight PMF Pad for Sleep, Meditation, Office, Yoga & Stress Relief - Canvas Bag, Twilight Echo",B0DB2WLLQF,https://www.amazon.com/dp/B0DB2WLLQF/?th=1,121,25.19,4.30,53,0.04,0,0,0.14,0,0,2024-10-23,Soliterra,Protection Island Imports
"Soliterra Grounding Mat for Feet - Foldable Earthing Grounding Mat for Bed with Tester Pen & Cord - Lightweight PMF Pad for Sleep, Meditation, Office, Yoga & Stress Relief - Canvas Bag, Desert Dusk",B0DB2VX837,https://www.amazon.com/dp/B0DB2VX837/?th=1,121,25.19,4.30,54,0.28,0.43,0,0,0,0,2024-10-22,Soliterra,Protection Island Imports
"ConBlom Grounding Mat for Bed, Cal King Size Earthing Mattress Cover Sheets Pad Grounding Kit, Grounding Cord Included (California King, 72 * 84”)",B0CZ445B6T,https://www.amazon.com/dp/B0CZ445B6T/?th=1,120,189.99,3.40,4,0.27,0.39,0,0.05,0,0,2024-03-27,ConBlom,ConBlom
"Grounding Mat for Bed, King Size Earthing Mattress Cover Sheets Pad Grounding Kit, Grounding Cord Included (King, 76 * 80')",B0CZ43DCYT,https://www.amazon.com/dp/B0CZ43DCYT/?th=1,120,149.99,3.50,22,0.12,0.18,0,0,0,0,2024-04-12,ConBlom,ConBlom
"Grounding Mat for Bed, Queen Size Earthing Mattress Cover Sheets Pad Grounding Kit, Grounding Cord Included (Queen, 60 * 80')",B0CZ44VGCF,https://www.amazon.com/dp/B0CZ44VGCF/?th=1,120,139.99,3.80,5,0.05,0,0,0.19,0,0,2024-04-14,ConBlom,ConBlom
"ConBlom Grounding Mat for Bed, Full Size Earthing Mattress Cover Sheets Pad Grounding Kit, Grounding Cord Included (Full,54 * 75“)",B0CZ3Y9KG1,https://www.amazon.com/dp/B0CZ3Y9KG1/?th=1,120,149.99,4.10,27,0.01,0,0,0.05,0,0,2024-04-14,ConBlom,ConBlom
"Earthing Elite Mattress Cover Kit (King Size), Clint Ober‘s Earthing Products, Grounding Mat for Bed",B08VSD26Z6,https://www.amazon.com/dp/B08VSD26Z6/?th=1,119,289.00,4.10,663,0.27,0.41,0,0,0,0,2021-03-27,Earthing,Earthing?
"Grounding Mat for Feet, Chair & Yoga | Earthing Grounding Mat for Pain Anxiety Pain Relief, Inflammation | Spacious Grounding Pads for Sleep & Wellness | Includes Grounding Tester, Cable & Mat Tester",B0DT6QSXZZ,https://www.amazon.com/dp/B0DT6QSXZZ/?th=1,119,29.69,5.00,6,0.13,0.19,0,0,0,0,2025-03-22,Earthly Echoes,Fly High Finds
"StarTech.com Anti-Static Mat - 25” x 27.5” Electrical Grounding Desk Pad - For Home or Work - Beige, TAA (M3013)",B00009XT3H,https://www.amazon.com/dp/B00009XT3H/?th=1,118,28.99,4.60,2373,0.10,0.16,0,0,0,0,2012-04-07,StarTech.com,Amazon
"Grounding Mat Earth Connected Mat 11.8'x23.6' Grounded Mat for Desk,Feet,Dogs with Bracelet,Testing Pen,Grounding Cord",B0DMN9XPRH,https://www.amazon.com/dp/B0DMN9XPRH/?th=1,115,23.99,4.30,10,0.09,0.10,0,0.09,0,0,2024-11-11,LAXVAPIU,MAOKE
"Grounding Mat Grounded Foot Pad 24'x36',Earth Connected Carbon Mat for Sleep with Testing Pen, Grounding Cord",B0DLNFJL7M,https://www.amazon.com/dp/B0DLNFJL7M/?th=1,115,23.79,4.00,13,0.18,0.21,0,0.14,0,0,2024-11-07,LAXVAPIU,MAOKE
"Grounding Mat 13'x24' Grounded Foot Pad Earth Connected Mat Therapy Pad with Testing Pen, Grounding Cord",B0DMNBZQQ5,https://www.amazon.com/dp/B0DMNBZQQ5/?th=1,115,19.79,4.30,12,0.08,0,0,0.28,0,0,2024-11-18,LAXVAPIU,MAOKE
"Grounding Mat Grounded Foot Pad 23.6“x35.4“,Earth Connected Carbon PU Mat for Sleep with Testing Pen,Bracelet,Grounding Cord",B0DN6NM7S6,https://www.amazon.com/dp/B0DN6NM7S6/?th=1,115,26.09,4.00,13,0.05,0.08,0,0,0,0,2024-12-12,LAXVAPIU,MAOKE
"Terra Sol Luxury Grounding Mat for Feet, 24x16in Earthing Mat Grounding Pad for Pain Relief, Inflammation, Better Sleep - Includes 15 ft Cord, Conductivity Tester, Socket Tester for Safe Use",B0DM4B7LVZ,https://www.amazon.com/dp/B0DM4B7LVZ/?th=1,114,51.99,5.00,2,0.43,0.41,0,0.56,0,0,2025-04-08,Terra Sol Grounding,Wayfarer Co
"Grounding Mat for Bed, Grounding Mattress Cover Pad for Improve Sleep, Conductive Carbon Leatherette Earth Mat Grounding Pad (54 * 78inch)",B096KFM2XT,https://www.amazon.com/dp/B096KFM2XT/?th=1,111,50.86,3.80,57,0.35,0.53,0,0,0,0,2021-06-05,VCLL-002,baixundianzi
"Grounding Mat for Bed, Grounding Mattress Cover Pad for Improve Sleep, Conductive Carbon Leatherette Earth Mat Grounding Pad (27 * 78inch)",B096K6MSTZ,https://www.amazon.com/dp/B096K6MSTZ/?th=1,111,38.99,3.80,44,0.26,0.16,0,0.56,0,0,2021-06-09,VAJOOCLL,baixundianzi
"Grounding Sheets,Grounding Mat for Bed 10% Pure Silver Fiber+90% Organic Cotton,with 15Ft Grounding Cord and Test Pen,104 * 23.6inch Suitable for All Mattress Sizes(White)",B0DZ2Z2W3S,https://www.amazon.com/dp/B0DZ2Z2W3S/?th=1,111,39.99,4.00,25,0.43,0.56,0,0.19,0,0,2025-04-01,VINIKYCA,Long Yi Xiang Inc
"Grounding Sheet, 90% Organic Cotton+10% Pure Silver Organic Fitted Grounded Sheet for Improved Sleep, Pain Relief - Earth Connected Bedding (Gray, (78.4 * 80.2 * 15inch))",B0DTPGKL2F,https://www.amazon.com/dp/B0DTPGKL2F/?th=1,106,--,2.70,5,0.05,0.06,0,0.05,0,0,2025-03-04,HLLBLL,N/A
"Bertech ESD Anti-Static Table Mat Kit, 16 In. x 24 In., Blue, Includes an ESD Wrist Strap and ESD Grounding Cord, MADE IN USA",B08722HKZK,https://www.amazon.com/dp/B08722HKZK/?th=1,105,65.99,4.40,364,0.03,0,0,0.09,0,0,2020-05-27,Bertech,Bertech Inc.
"Grounding Mat Plus Ground Cord Earth Product Kit for Better Sleep, Reduce Stress - 54'x78' Size, Queen Mattress Size, Breathable, Red Color",B097D3Q19W,https://www.amazon.com/dp/B097D3Q19W/?th=1,102,76.74,3.70,221,0.19,0.27,0,0.05,0,0,2021-08-04,NIULAFR,xinniushuinuan
"Ground Well Grounding Mat for Feet,Grounding Pad for Stress, Pain, Inflammation& Wellness Support, 26.7x10in Portable Size Grounding Mat, Indoor Grounding at Home,Office. 15Ft Cord Included.",B07Z3WWLKT,https://www.amazon.com/dp/B07Z3WWLKT/?th=1,100,19.99,4.10,1842,0.48,0.72,0,0,0,0,2019-10-14,ATE Health,ATE Health
"Grounding Mat for Improved Sleep, Reduced Anxiety, Pain, Inflammation, Headache Relief, Balance. Grounded Therapy- (Black, (76.1 * 27.4inch))",B0DT163V4T,https://www.amazon.com/dp/B0DT163V4T/?th=1,100,79.99,3.00,4,0.44,0.66,0,0,0,0,2025-01-14,HLLBLL,Luonavei-US
"Grounding Mat for Bed, PU Leather Grounding Mattress with Wrist Straps，2 Cords and Plug for Better Sleep, Grounding Sheets for Restful Sleep(Queen - 27'x 60')",B0DT8XJ2W8,https://www.amazon.com/dp/B0DT8XJ2W8/?th=1,99,32.39,4.40,13,0.04,0.04,0,0.05,0,0,2025-02-19,AITUOMED,maxgrounding
"Grounding Mat for Bed, Upgraded Grounding Pad with Pattern Earth Mat with Testing Pen, Grounding Mat for Sleeping (24“ 35.4“ Pen)",B0CXMF7SH8,https://www.amazon.com/dp/B0CXMF7SH8/?th=1,97,9.99,4.00,69,0.13,0.19,0,0,0,0,2024-03-28,HOOTACH,HOOTACH
"Grounding Mat for Bed, Upgraded Grounding Pad with Pattern Earth Mat with Testing Pen, Grounding Mat for Sleeping (13” 24” pen) black",B0CXMDS78J,https://www.amazon.com/dp/B0CXMDS78J/?th=1,97,16.50,4.00,69,0.27,0.41,0,0,0,0,2024-04-03,HOOTACH,HOOTACH
"Grounding Sheets, for All Mattress Size, 90% Organic Cotton+10% Pure Silver Fiber, Earth Connected, Healthy Sleep, with Static grounding Cord and Test Pen (Gray, 105 * 23 inch)",B0DKY939DL,https://www.amazon.com/dp/B0DKY939DL/?th=1,97,20.00,4.90,45,0.05,0,0,0.19,0,0,2025-03-03,Pillcase,Pillcase-US
"Grounding Mat Kit,Grounding Mats for Bed, Grounding Mat with 15FT Grounding Cord and Grounding Wristband(11.8x23.6inch)",B0C2YPCCY8,https://www.amazon.com/dp/B0C2YPCCY8/?th=1,94,10.00,3.80,96,0.37,0.55,0,0.05,0,0,2023-05-03,COUSLEWI,boyisheng
"Grounding Mat Printed, 35.4 * 23.6 in Universal Conductive Grounding mat for Bed, Earth Mat Grounding Pad for Better Sleep, Reduce Anxiety, Feet and Back Pain, Inflammation, Headache Relief",B0CT5QWVHH,https://www.amazon.com/dp/B0CT5QWVHH/?th=1,91,9.94,3.10,32,0.31,0.47,0,0,0,0,2024-02-28,YEOUMIAR,YOUMIAO
"Grounding Sheet, 90% Organic Cotton+10% Pure Silver Organic Grounded Sheet for Improved Sleep, Pain Relief, with Static Grounding Cord and Test Pen (Gray, King(78.1 * 80.1 * 15 in))",B0DLMXWN1X,https://www.amazon.com/dp/B0DLMXWN1X/?th=1,86,59.60,4.50,34,0.03,0,0,0.09,0,0,2025-02-09,Pillcase,Pillcase-US
"Pure Copper Nose Wand C Natural Copper Nasal Swab Stick for Wellness C Copper Wand, Copper Nose Swab, Copper Stick for Nose ZapC Created by American Ayurveda (2 Count)",B08B5J31KX,https://www.amazon.com/dp/B08B5J31KX/?th=1,85,64.99,4.40,285,0.03,0,0,0.09,0,0,2020-07-06,A,American Ayurveda
"Grounding Mat for Bed, BOVEREY Grounded Mat Earth Connected Grounding Pad for Sleeping, Grounded Mattress Cover Kit, Cord & Tester Included (Black, Queen)",B0DKJCXKNS,https://www.amazon.com/dp/B0DKJCXKNS/?th=1,85,41.99,4.10,62,0.43,0.64,0,0,0,0,2025-02-26,BOVEREY,Grounded shop
"Grounding Mat Kit, 2 Pack Grounding Mat 10 x 26.7', Grounding Pad with 2 Grounding Cord and Wrist Strip for Sleep, Pain, Inflammation, Energy",B0D2LK7JCX,https://www.amazon.com/dp/B0D2LK7JCX/?th=1,84,25.99,3.70,35,0.46,0.64,0,0.14,0,0,2024-06-18,seader,seader
"Grounding Mat for Sleep, Energy, Pain Support & Inflammation Relief C 24'x16' Earthing Mat for Feet, Stress Relief, Balance & Wellness C Includes 15ft Cord for Home & Office Use",B0DTGN7N8C,https://www.amazon.com/dp/B0DTGN7N8C/?th=1,84,28.49,4.50,8,0.34,0.23,0,0.65,0,0,2025-02-20,Astarexin,RUISQM
"Grounding Mat for Bed, Breathable, Grounding Pad for Sleep, Grounding Mats for feet, Enhances Sleep Quality, Improves Blood Circulation 12x24IN",B0C4T9HTDX,https://www.amazon.com/dp/B0C4T9HTDX/?th=1,83,9.99,5.00,2,0.40,0.60,0,0,0,0,2023-05-24,COUSLEWI,boyisheng
"Grounding Mat for Daily Comfort & Balance - Grounding Mat for Feet, Desk, Bed & Floor - Durable, Eco-Friendly Material - 24x16 inches Earthing Mat Includes 15ft Grounding Cord",B0DQ2H9H13,https://www.amazon.com/dp/B0DQ2H9H13/?th=1,83,17.99,4.00,34,0.55,0.64,0,0.46,0,0,2024-12-10,ARTTONA,VEROZON
"hooga Grounding Blanket for Improved Sleep, Pain Relief, Energy, Inflammation. Grounded Throw, Earth Connected Bedding. Conductive Silver Fiber. Grounding Cord Included. 50 x60 Inch Throw.",B08Z64969P,https://www.amazon.com/dp/B08Z64969P/?th=1,82,99.00,4.30,377,0.31,0.47,0,0,0,0,2021-08-02,hooga,Hooga Health
"hooga Grounding Blanket for Improved Sleep, Pain Relief, Energy, Inflammation. Grounded Throw, Earth Connected Bedding. Conductive Silver Fiber. Grounding Cord Included. 60 x80 Inch, Queen Size.",B0BKMQDCM8,https://www.amazon.com/dp/B0BKMQDCM8/?th=1,82,139.00,4.30,377,0.04,0.06,0,0,0,0,2022-11-04,hooga,Hooga Health
"Conductivity Test Pen, Continuity Tester for Grounding Mats Pads Sheets Pillow Cases Blankets Wristband Ground Tester Conductive Pen for Ensuring Effective Earthing Connection",B0DZWWW56G,https://www.amazon.com/dp/B0DZWWW56G/?th=1,82,--,3.70,5,0.10,0.16,0,0,0,0,2025-03-21,BTFO,N/A
"РЕМF Far Infrared Heating Pad - Professional Biomat for Pain Relief and Healing - Pulsed Electromagnetic Field Therapy - Full Short Body Mat Auto Shut Off - Amethyst, Tourmaline and Obsidian Gemstones",B07GVMBMMT,https://www.amazon.com/dp/B07GVMBMMT/?th=1,78,639.00,4.40,271,0.09,0,0,0.33,0,0,2018-08-27,HealthyLine,HealthyLineCom
"ElectraWave Grounding Mat for Sleep, Energy, Pain Relief, Inflammation, Balance, Wellness. Earth Connected Therapy. Indoor Grounding at Home, Office, Work. 15 Foot Cord Included. Conductive Carbon",B0DG3RZ6TM,https://www.amazon.com/dp/B0DG3RZ6TM/?th=1,77,29.74,4.30,44,0.15,0.16,0,0.19,0,0,2024-09-16,ELECTRAWAVE,The Texas Super Store
"Grounding Patches 8 Pack, Reusable Adhesive Grounding Pad, Grounding Slice for Any Body Part, Earth Connected Grounding Therapy Grounding Products",B0DRY8RSZ8,https://www.amazon.com/dp/B0DRY8RSZ8/?th=1,75,15.99,--,0,0.03,0,0,0.09,0,0,2025-02-09,seader,seader
"Grounding Mat for Improved Sleep, Reduced Anxiety, Pain, Inflammation, Headache Relief, Balance. Grounded Therapy- (Black,Twin XL(39.4 * 27.3inch))",B0DR188HPX,https://www.amazon.com/dp/B0DR188HPX/?th=1,74,20.00,4.90,63,0.06,0.10,0,0,0,0,2025-04-10,HLLBLL,Luonavei-US
"Grounding Sheets, Grounded Half Flat Sheet 24'x110' Fit All Bed Sizes, Conductive Sheets with Cord & Clips, Earth Connected Sheet for Improved Sleep, Cotton+Silver Fiber(White, 1 Pack)",B0D7G7HWDL,https://www.amazon.com/dp/B0D7G7HWDL/?th=1,72,29.99,3.70,231,0.26,0.02,4.53,0,0,0,2024-07-18,Merisky,Merisky Direct
"Grounding Mat for Improved Sleep, Reduced Anxiety, Pain, Inflammation, Headache Relief, Balance. Grounded Therapy- (Black, (72.2 * 54inch))",B0DSSRWZQB,https://www.amazon.com/dp/B0DSSRWZQB/?th=1,69,--,5.00,1,0.08,0.12,0,0,0,0,2025-03-27,HLLBLL,N/A
"Grounding Sheets King Size, 95% Organic Cotton + 5% Pure Silver Fiber, Grounding Sheet Earth Connected Bedding (King - 77'x 80'x 13' Gray) Fitted Earth Sheets with Grounding Cord",B0D1H2JB1P,https://www.amazon.com/dp/B0D1H2JB1P/?th=1,68,99.99,3.90,319,0.04,0.06,0,0,0,0,2024-04-19,ZAJAZ,KevinInter
"Feraco Grounding Mat for Bed, Grounding Pad Kit for Sleeping & Overall Well-Being with Cord & Tester (King, 27' x 76')",B0D6YPMSSX,https://www.amazon.com/dp/B0D6YPMSSX/?th=1,66,25.99,3.70,134,0.30,0.45,0,0,0,0,2024-07-16,Feraco,FeracoDirect
"Grounding Bed Sheet Queen Size - 90% Organic Cotton & 10% Silver Fiber Earthing Sheet for Healthy Sleep Therapy, Grounding Mat for Bed (80'x60' Fits Queen Bed)?",B0DRSKJNT4,https://www.amazon.com/dp/B0DRSKJNT4/?th=1,66,46.19,5.00,7,0.01,0,0,0.05,0,0,2025-03-04,Amzeth,Amzeth
"Grounding Mat for Bed, Earth Connected Mattress Cover Grounding Pad Grounded Kit, Grounded Cord Included, Black (Queen 27'x60')",B0D7MMNRT4,https://www.amazon.com/dp/B0D7MMNRT4/?th=1,65,39.47,4.00,396,0.64,0.62,0,0.51,13.73,0,2024-06-22,VOREEK,Voreek Home
"Grounding Mat 15 Feet Grounding Well Mat Reduce Stress, Boost Energy & Wellness, Perfect for Desk, Bed, Office, and Living Spaces",B0DNMQQ5YN,https://www.amazon.com/dp/B0DNMQQ5YN/?th=1,65,28.49,3.40,21,0.18,0.10,0,0.42,0,0,2025-01-24,EarthNest,EarthNest
"Grounding Mat for Bed, Grounded Pad for Sleep, Anti-Slip PU Leather Mattress with Grounding Cord, 27’’×76‘’, King",B0F43XB2R4,https://www.amazon.com/dp/B0F43XB2R4/?th=1,65,--,5.00,37,0.01,0.02,0,0,0,0,2025-04-09,Dragsui,N/A
