产品名称,ASIN,URL,Listing月销量,实际价格( $ ),评分星级,评价数量,曝光占比,曝光占比,曝光占比,曝光占比,曝光占比,曝光占比,上架时间,品牌,卖家
"Grounding Mat, Energy, Pain Relief, Inflammation, Balance, Wellness. Earth Connected Therapy. Indoor Grounding at Home, Office, Work. 15 Foot Cord Included.B5, 23.6x12.9in",B0DTGGKP6Z,https://www.amazon.com/dp/B0DTGGKP6Z/?th=1,30,17.94,4.50,2,0.01,0,0,0.05,0,0,2025-03-02,Generic,Ruyueheng US Store
"ConBlom Grounding Mat for Bed, Queen Size Earthing Mattress Cover Sheets Pad Grounding Kit, Grounding Cord Included (Queen, 60 * 27“)",B0DT4C3DPG,https://www.amazon.com/dp/B0DT4C3DPG/?th=1,30,47.99,3.90,18,0.01,0,0,0.05,0,0,2025-03-18,ConBlom,ConBlom
"ConBlom Grounding Mat for Bed, King Size Earthing Mattress Cover Sheets Pad Grounding Kit, Grounding Cord Included (King, 76 * 27“)",B0DT4FL1C9,https://www.amazon.com/dp/B0DT4FL1C9/?th=1,30,55.99,4.00,14,0.03,0,0,0.09,0,0,2025-03-18,ConBlom,ConBlom
"Grounding Mat for Bed, Cal King Size Earthing Mattress Cover Sheets Pad Grounding Kit, Grounding Cord Included (California King, 72 * 27')",B0DT4BB4V1,https://www.amazon.com/dp/B0DT4BB4V1/?th=1,30,42.23,4.00,14,0.03,0,0,0.09,0,0,2025-03-17,ConBlom,ConBlom
"Grounding Mat for Bed C Anti-Slip PU Leather Grounding Pad for Sleep with Grounding Cord, Grounding Mattress for Better Rest and Recovery (Queen)",B0DXLV97DR,https://www.amazon.com/dp/B0DXLV97DR/?th=1,30,36.99,5.00,1,0.08,0.12,0,0,0,0,2025-05-17,SHARK MEDICAL,SHARK MEDICAL INC.
"Grounding Mat for Bed King, 76'x80' Earthing Mat Grounding Pad for Better Sleep, Pain and Stress Relief, Conductive Carbon Fiber with Cord, Safe & Durable",B0F2MBGBW6,https://www.amazon.com/dp/B0F2MBGBW6/?th=1,29,169.99,4.60,21,0.01,0.02,0,0,0,0,2025-05-05,FormiPow,framita
Grounding Sheets with Grounding Cord - Silver Fiber Conductive Sheet (27x52 inch),B08D3VF97V,https://www.amazon.com/dp/B08D3VF97V/?th=1,28,18.99,3.80,413,0.19,0.29,0,0,0,0,2020-11-17,CUAOCOS,maanshanbiemaiting
"Grounding Sheet with Grounding Cord,Made with Premium Cotton and Pure Silver Fiber, Fabric,Achieve Healthy Sleep(52x27inch)",B07NLFS4S1,https://www.amazon.com/dp/B07NLFS4S1/?th=1,27,16.49,4.10,174,0.23,0.27,0,0.19,0,0,2020-10-30,Tayte,jinmutu
"Grounding Fitted Sheet for Earthing Queen Size, 95% Organic Cotton+5% Silver Fiber, Gray Conductive Grounded Sheets, 400 Thread Count Soft Earthing Sheet with Grounding Cord for Healthy Sleep Therapy",B0DPPQBLQS,https://www.amazon.com/dp/B0DPPQBLQS/?th=1,27,109.99,3.20,4,0.01,0,0,0.05,0,0,2025-02-27,RestGrounded,RestGrounded
"Grounding Mat for Bed, Queen Size, Brown, Faux Leather, Spot Clean Only, Grounding Therapy",B0DN6531R4,https://www.amazon.com/dp/B0DN6531R4/?th=1,26,47.68,4.00,14,0.52,0.51,0,0.65,0,0,2024-11-28,SHUOGVER,SHUANGWEN
"Geometry Grounding Mat,15ft Grounding Cord,Grounding Pad Kit, Earth Therapy for Foot Mat,Computer Mat, Sleep Mat, Pet Mat (26.7x10 Inch)",B0DKJW9FRN,https://www.amazon.com/dp/B0DKJW9FRN/?th=1,26,--,5.00,2,0.04,0.06,0,0,0,0,2024-12-22,FXYSWGA,N/A
"Grounding Mat for Bed, Grounding Pad for Sleeping, Reduce Anxiety and Inflammation, Pain Relief, Improve Energy - Pure Silver Fiber, Grounding Cord, Test Pen & Safety Adapter (King)",B0DHCLMXL5,https://www.amazon.com/dp/B0DHCLMXL5/?th=1,25,53.19,4.30,77,0.03,0.02,0,0.05,0,0,2024-11-09,XKETA,XKETA
"Grounding Mat for Bed, Grounding Pad for Sleeping, Reduce Anxiety and Inflammation, Pain Relief, Improve Energy - Pure Silver Fiber, Grounding Cord, Test Pen & Safety Adapter (Queen)",B0DHCN3WJF,https://www.amazon.com/dp/B0DHCN3WJF/?th=1,25,44.99,4.30,76,0.30,0.45,0,0,0,0,2024-11-12,XKETA,XKT-US
"Jffszsd 13“ x 23.6“ Grounding Mat Kit with 15ft Grounding Cord, Black Anti-Slip Rectangular Mat for Health, Sleep, Pets",B0CDWW5S8Z,https://www.amazon.com/dp/B0CDWW5S8Z/?th=1,23,15.66,3.50,35,0.45,0.66,0,0.05,0,0,2023-10-11,Jffszsd,foshan heathly
"GroundFlow Grounding Mat - Conductive Carbon Indoor Grounding Therapy Pad with Extra Long 15’ Cord for Desk, Bed, Living Room - Soft, Thick Earth Mat for Sleep, Pain Relief, Wellness - 24 x 16 Inches",B0DHD48V21,https://www.amazon.com/dp/B0DHD48V21/?th=1,23,29.90,3.70,40,0.45,0.16,0,1.25,0,0,2024-11-26,FLexiknee,MassageLab
"HOOTACH Grounding Mat for Sleeping, Upgraded Grounding Pad with Pattern Earth Mat with Testing Pen and Grounding Cord, Grounding Mat for Sleeping for Bed (9.8” 11.8” Pen)",B0D2K8565P,https://www.amazon.com/dp/B0D2K8565P/?th=1,22,17.99,4.00,46,0.03,0.04,0,0,0,0,2024-05-22,HOOTACH,HOOTACH
"Grounding Mat, 15 ft Grounding Cord, Earthing Therapy Foot Mat, 24' X 16', for Improved Sleep, Reduced Inflammation, Stress Relief",B0DCYXV4YV,https://www.amazon.com/dp/B0DCYXV4YV/?th=1,22,28.99,3.40,47,0.22,0.19,0,0.33,0,0,2024-09-14,Zengrounded,WellGrounded
"Grounding Mat, 24' x 35', Cream, with 15ft Grounding Cord for Stress Relief, Pain Management, Better Sleep (Gray, 24 * 35 inch)",B0DNJKBMRY,https://www.amazon.com/dp/B0DNJKBMRY/?th=1,22,22.99,5.00,3,0.26,0.33,0,0.14,0,0,2024-12-12,VAJOOCLL,baixundianzi
"Grounding Mat,Universal Grounding Pad with 15ft Straight Cord for Grounded Foot Pad,Computer Keyboard Mat,Fits for Better Working and Sleep (11.8*23IN)",B09ZYB7197,https://www.amazon.com/dp/B09ZYB7197/?th=1,21,22.78,4.20,217,0.35,0.53,0,0,0,0,2022-06-21,KLASLAV,zhifandianzicailiao
"Grounding Mat,Universal Grounding Pad with 15ft Straight Cord for Grounded Foot Pad,Computer Keyboard Mat,Fits for Better Working and Sleep(23 * 35IN)",B09ZY4NNV3,https://www.amazon.com/dp/B09ZY4NNV3/?th=1,21,26.06,4.20,217,0.12,0.16,0,0.05,0,0,2022-08-18,KLASLAV,zhifandianzicailiao
"Grounding Mat, Grounding Sleep Mat Grounding Mat for Bed, 100% Conductive Carbon Leatherette Therapy mat with Cord, Grounding Sleep Mat for Earth Relieve Pain (54-71 inch)",B0BWMWZMX5,https://www.amazon.com/dp/B0BWMWZMX5/?th=1,21,59.99,3.60,163,0.36,0.53,0,0.05,0,0,2023-03-07,QYWOVPNBFCD,SUZHOUYUANHONGYILIAOKEJIYOUXIANGONGSI
"Grounding Mat for Bed, Grounding Mat with 10% Silver Fiber and 90% Cotton, 27’’x76’’ Connected Earth Grounding Sheets with Outlet Tester and Grounding Cord (King)",B0DQL73WPZ,https://www.amazon.com/dp/B0DQL73WPZ/?th=1,21,32.49,3.00,2,0.06,0,0,0.23,0,0,2024-12-25,MQHOOB,MQHOOB
"Amerthing Grounding Mats - Upgraded Healthy Conductive Energy Pads to Earth for Bed and Seats to Sleep Better and Recovery, Silver Fiber Indoor and Portable Relax Blanket.",B08QMPF13K,https://www.amazon.com/dp/B08QMPF13K/?th=1,20,32.97,3.90,52,0.04,0.06,0,0,0,0,2020-12-29,Amerthing,Amerthingfactory
"Grounding Mat with 2 Grounding Cords for Improving Sleep, Grounding Sheet with Test Pen, Grounding Mat for Pain Relief, Wellness, (54“ 71“ 2 Cords Pen)",B0CXM6VM9M,https://www.amazon.com/dp/B0CXM6VM9M/?th=1,20,63.99,4.20,32,0.01,0,0,0.05,0,0,2024-04-12,HOOTACH,HOOTACH
"Grounding Yoga Mat, 72x24inch, Earthing Sleep Pad for Physical Therapy, Exercise & Workout Non Slip Mat, Reduce Anxiety and Improve Sleep",B0CDWHTMMT,https://www.amazon.com/dp/B0CDWHTMMT/?th=1,19,79.99,4.60,33,0.32,0.04,0,1.07,0,0,2023-08-07,LekDrok,LekDrok
"Grounding Square Pad for Sleep -Stainless Steel Fabric, 20 x20 inch (Navy), Dog and cat grounding mat",B0CQNS2G2K,https://www.amazon.com/dp/B0CQNS2G2K/?th=1,19,38.50,5.00,1,0.12,0.14,0,0.09,0,0,2024-02-27,shieldgreen,shieldgreen
"Grounding Mat, Balance Energy, Pain Relief, Inflammation, Improve Wellness, Grounded Foot Therapy",B0DJ2NZ69V,https://www.amazon.com/dp/B0DJ2NZ69V/?th=1,19,18.99,3.80,62,0.49,0.66,0,0.19,0,0,2024-10-08,Voocvii,Voocvii Shop
Grounding Mat Cotton Grounding Sleep Sheet with 15Ft Grounding Cord Silver Fiber Earth Connected Mat for Improve Sleep Energy Wellness Balance Bed Use Beige 35'×50',B0DGFY99G5,https://www.amazon.com/dp/B0DGFY99G5/?th=1,18,35.99,3.50,7,0.41,0.62,0,0,0,0,2024-10-15,MAOOHON,MAOHONGHB
"Grounding Mat,Mat Improves Sleep, 15ft Grounding Cord,Reduces Inflammation, Pain, and Anxiety(23.6x13 Inch)",B0DKJTS73W,https://www.amazon.com/dp/B0DKJTS73W/?th=1,18,--,5.00,1,0.14,0,0,0.51,0,0,2024-12-11,Horuoaii,N/A
Grounding Sheets Queen Size - Grey Earthing Sheets for Natural Sleep Enhancer - 95% Organic Cotton + 5% Pure Silver Fiber Fitted Grounding Bed Sheets with Grounding Cord for Cozy Night,B0DJXSKYFH,https://www.amazon.com/dp/B0DJXSKYFH/?th=1,17,67.00,3.90,9,0.05,0,0.95,0,0,0,2024-11-18,Callarome,Callarome
Grounding Sheets King Size - Grey Earthing Sheets for Natural Sleep Enhancer - 95% Organic Cotton + 5% Pure Silver Fiber Fitted Bed Sheets With Cord for Luxurious Comfort,B0DJXSTM8M,https://www.amazon.com/dp/B0DJXSTM8M/?th=1,17,69.97,3.90,10,0.05,0,0.95,0,0,0,2024-11-18,Callarome,Callarome
Grounding Sheets Twin Size - Grey Earthing Sheets for Natural Sleep Enhancer - 95% Organic Cotton + 5% Silver Fiber Fitted Grounding Bed Sheets with Grounding Cord - Experience Ultimate Relaxation,B0DJXZLMWT,https://www.amazon.com/dp/B0DJXZLMWT/?th=1,17,62.00,4.10,4,0.05,0,0.95,0,0,0,2024-11-18,Callarome,Callarome
"Grounding Mat for Better Sleep with 15ft Grounding Cord,Grounding Pad Kit, Earth Therapy for Foot Mat,Computer Mat, Sleep Mat, Pet Mat(23.6x13 Inch)",B0CXXHBP1Q,https://www.amazon.com/dp/B0CXXHBP1Q/?th=1,16,22.99,4.20,15,0.04,0.06,0,0,0,0,2024-03-13,HRSDZKJ,hairuida
"Grounding Mat 34.2x50 Inch, Ground Blanket with Silver Fiber & Cotton for Stress Relief & Sleep Improvement, Couch/Bed Use",B0D2MGD5NZ,https://www.amazon.com/dp/B0D2MGD5NZ/?th=1,16,55.80,3.90,13,0.05,0,0,0.19,0,0,2024-05-25,MINPWNP,BOYUEGE
"Grounding Mat 23.6x34.2 Inch, Ground Blanket with Silver Fiber & Cotton for Stress Relief & Sleep Improvement, Couch/Bed Use",B0D2L3ZQ5T,https://www.amazon.com/dp/B0D2L3ZQ5T/?th=1,16,36.34,4.10,47,0.10,0.08,0,0.19,0,0,2024-06-08,MINPWNP,BOYUEGE
Grounding Mats for Health VAJOOCLL Grounding Pad for Improving Sleep 2 Grounding Mats with 2 Grounding Cords for Better Working and Sleep Assist 2 Pieces 13IN * 23.6IN,B0B5X1QNNJ,https://www.amazon.com/dp/B0B5X1QNNJ/?th=1,15,32.55,3.90,16,0.03,0.04,0,0,0,0,2022-08-11,VAJOOCLL,baixundianzi
Grounding Fitted Sheet Kit Twin XL Size 15' Deep Pocket Earthing Fitted Bottom Sheet + Earthing Product Tester + U.S. Outlet Checker,B09V7LRD6W,https://www.amazon.com/dp/B09V7LRD6W/?th=1,15,96.99,4.00,134,0.06,0,0,0.23,0,0,2022-05-20,earthinglife,earthinglife health
"Grounding Mat for Desk,Grounding Mats 11.8 * 23 Inch Grounding Mat for feet,Improved Sleep Grounding Mat with Grounding Cord for Better Working,Sleep Assist",B0B5WY787S,https://www.amazon.com/dp/B0B5WY787S/?th=1,15,14.99,3.90,60,0.06,0.10,0,0,0,0,2022-10-10,VAJOOCLL,baixundianzi
Grounding Fitted Sheet Kit King Size 15“ Deep Pocket Earthing Fitted Bottom Sheet + Earthing Product Tester + U.S. Outlet Checker,B09V7MZBRP,https://www.amazon.com/dp/B09V7MZBRP/?th=1,15,124.99,4.00,135,0.01,0,0,0.05,0,0,2022-05-28,earthinglife,earthinglife health
"NIULAFR Grounding Mat with 15ft Grounding Cord,Grounding Pad Kit 15.7 x 19.6 Inch, Earth Therapy for Foot Mat,Computer Mat, Sleep Mat, Pet Mat",B0C4L2D2R1,https://www.amazon.com/dp/B0C4L2D2R1/?th=1,15,27.89,4.10,32,0.03,0.04,0,0,0,0,2023-05-25,NIULAFR,xinniushuinuan
"23.6'x35.4' Printed Grounding Mat with 15FT Grounding Wire, Grounding Therapy, Grounding Mat for Improve Sleep and Help with Anxiety",B0D4163L94,https://www.amazon.com/dp/B0D4163L94/?th=1,15,13.30,3.90,67,0.61,0.70,0,0.51,0,0,2024-06-15,MIUQAOKL,MIUQAOKL
"11.8“x23.6“ Printed Grounding Mat with 15FT Grounding Wire, Grounding Therapy, Grounding Mat for Improve Sleep and Help with Anxiety",B0D95K52Y9,https://www.amazon.com/dp/B0D95K52Y9/?th=1,15,16.37,3.90,67,0.05,0,0,0.19,0,0,2024-07-13,MIUQAOKL,MIUQAOKL
"Vegan Leather Grounding Mat Earthing - Premium Grey Grounding Mat for Feet, Desk, Bed or Yoga - Comfortable Earthing Mat Grounding Pad - Radiant Harmony Grounding Mat",B0DBN1TMDP,https://www.amazon.com/dp/B0DBN1TMDP/?th=1,15,19.99,4.30,51,0.36,0.53,0,0.05,0,0,2024-10-08,RADIANT HARMONY,Radiant Harmony
"Mattress - High-Density Foam Pad & Cushion for Beds & DIY Projects - Quilted/Water-Resistant Cover, Mid-Firm or Firm, Optional Gel Memory Foam Add-On",B0F3ZD7MPD,https://www.amazon.com/dp/B0F3ZD7MPD/?th=1,15,--,--,0,0.01,0,0,0.05,0,0,2025-04-13,Generic,N/A
Grounding Fitted Sheet Kit Connect to The Earth’s Energy 18inch Depth Pocket Grounding Bed Sheets for Earthing,B0CCJCPV7V,https://www.amazon.com/dp/B0CCJCPV7V/?th=1,14,156.99,3.90,55,0.21,0.31,0,0,0,0,2023-07-28,earthinglife,earthinglife health
"Grounding Mat Grounded Foot Pad 11.8”x23.6” Universal Grounding Mat for Work Desk, Computer, Relieve Pain with 15ft Cord",B0CNTF7W57,https://www.amazon.com/dp/B0CNTF7W57/?th=1,14,9.99,3.70,29,0.01,0.02,0,0,0,0,2023-12-05,XINHUSU,XINHUAI
Grounding Fitted Sheet Kit Connect to The Earth’s Energy 18inch Depth Pocket Grounding Bed Sheets for Earthing,B0D457YNNW,https://www.amazon.com/dp/B0D457YNNW/?th=1,14,156.99,3.90,55,0.01,0,0,0.05,0,0,2024-05-29,earthinglife,earthinglife health
"Grounding Mat for Bed, Breathable Grounding Pad Earth Mat for Bettet Sleep, Energy, Pain Relief, Inflammation, Feet and Back Pain (54' x 78')",B0CR15Y176,https://www.amazon.com/dp/B0CR15Y176/?th=1,13,47.49,3.40,17,0.13,0.16,0,0.09,0,0,2024-02-09,YEOUMIAR,YOUMIAO
"Grounding Mat Kit (23.6x13 Inch) Computer Mat, Sleep Mat,Computer Mat, Sleep Mat,Earth Mat, Grounding Pad, Mat for Reduce Pain and Inflammation",B0DKHCY91F,https://www.amazon.com/dp/B0DKHCY91F/?th=1,13,--,5.00,2,0.08,0.10,0,0.05,0,0,2024-12-18,Horuoaii,N/A
"Fitted Grounding Sheets for Earthing Improved Sleep, Grounding Blanket Sleeping Aid, Grounding Bed Sheets Conductive Pad Silver Fiber with Ground to Earth Cable (Grey, Queen 60''*80''*12'')",B0CTCNSJN8,https://www.amazon.com/dp/B0CTCNSJN8/?th=1,13,45.99,4.00,95,0.03,0,0,0.09,0,0,2024-03-24,Reaeng,speedingd
"Fitted Grounding Sheets King Size Improved Sleep, Grounding Blanket Sleeping Aid, Grounding Bed Sheets Conductive Pad Silver Fiber with Ground to Earth Cable (Beige, California King 72“X84“X13“)",B0CTCW845G,https://www.amazon.com/dp/B0CTCW845G/?th=1,13,12.99,4.00,93,0.03,0,0,0.09,0,0,2024-02-25,Reaeng,speedingd
Grounding Sleeping Mat for Bed - Queen Size Mattress Cover Pads (27“x60“) Product Kit for Feet Sleep Rest Yoga Workout Pain Relief Balance Wellness - Earth Connected Grounded PMF Mat (Queen),B0DKGDC31Z,https://www.amazon.com/dp/B0DKGDC31Z/?th=1,12,34.99,4.20,112,0.01,0.02,0,0,0,0,2024-10-23,HomeLuvo,Maxwich
Grounding Sleeping Mat for Bed - King Size Mattress Cover Pads (27'x76') Product Kit for Feet Sleep Rest Yoga Workout Pain Relief Balance Wellness - Earth Connected Grounded PMF Mat (King),B0DKGDLGD1,https://www.amazon.com/dp/B0DKGDLGD1/?th=1,12,39.99,4.20,113,0.39,0.56,0,0.05,0,0,2024-10-22,HomeLuvo,Maxwich
"Grounding Mat for Bed,27x60In Grounding Pad for Sleep,For Better Sleep,Balance,Reduced Anxiety & Inflammation,Pain Relief,Anti-Slip Tear-Resistant PU Leather with Grounding Cord Grounding Sheets Queen",B0DNJQM41P,https://www.amazon.com/dp/B0DNJQM41P/?th=1,12,42.99,4.30,11,0.12,0,0,0.42,0,0,2025-01-15,TJJSNA,TJJSNA-US
Grounding Mat Kit-Upgraded Universal Grounding Mat with 15ft Grounding Cord C Enhanced Conductivity for Effective Grounding 27x11 Inch,B0DT15C8P6,https://www.amazon.com/dp/B0DT15C8P6/?th=1,12,19.89,3.90,9,0.48,0.68,0,0.09,0,0,2025-02-02,MCZAROA,MCZAROA?
"Puregrounding? Grounding Sheet 20' x 104' for Sleep, Pain Relief, Anti-Inflammation, Mood, Earthing Sheet",B0DT96F2TL,https://www.amazon.com/dp/B0DT96F2TL/?th=1,12,39.80,4.20,9,0.03,0,0,0.09,0,0,2025-02-06,PureGrounding,WellGrounded
"Grounding Mat Kit,Universal Grounded Pad with 15ft Grounded Cord, Grounding Foot, Computer, Sleep Mat, Keep Healthy(23.6“ x 35.4“)",B0CNRNCTM2,https://www.amazon.com/dp/B0CNRNCTM2/?th=1,11,14.24,3.80,23,0.37,0.56,0,0,0,0,2023-12-29,MATFORTH,earthyogic
"LAXVAPIU Grounding Cotton Mat Silver Fiber Grounding Bed Mattress Quilted Pad Earth Connected Cloud Bedding (Grey, 24x35 Inch)",B0DGWW5SXW,https://www.amazon.com/dp/B0DGWW5SXW/?th=1,11,39.94,3.80,21,0.34,0.51,0,0,0,0,2024-09-18,LAXVAPIU,MAOKE
"Grounding Mat (23.6x13 Inch) Computer Mat, Sleep Mat,Earth Mat, Grounding Pad, Mat for Reduce Pain and Inflammation",B0DKHB3CM7,https://www.amazon.com/dp/B0DKHB3CM7/?th=1,11,16.99,4.50,24,0.04,0.02,0,0.09,0,0,2024-12-03,Horuoaii,Xinqi Home Furnishings
"Urvoix Grounding Mat for Feet, 12.5' x 29'(2Pack) Earth Mat Grounding Pad for Sleep, Boost Energy & Wellness, Earth Therapy, Grounding at Home, Office, Work | Includes Conductive Test Pen",B0DPHN4QRF,https://www.amazon.com/dp/B0DPHN4QRF/?th=1,11,35.09,4.10,11,0.01,0,0,0.05,0,0,2025-01-15,Urvoix,UrVoix
Grounding Mat Kit-Upgraded Universal Grounding Mat with 15ft Grounding Cord C Enhanced Conductivity for Effective Grounding 2Pk 27x11 Inch,B0DT65JWVP,https://www.amazon.com/dp/B0DT65JWVP/?th=1,11,28.89,3.00,4,0.43,0.64,0,0,0,0,2025-01-15,MCZAROA,MCZAROA?
"Grounding Mat for Better Sleep-(Black, (60.1 * 27.5inch))",B0DQFYW3G3,https://www.amazon.com/dp/B0DQFYW3G3/?th=1,11,35.00,4.70,66,0.12,0.18,0,0,0,0,2025-02-20,HLLBLL,Luonavei-US
"Urvoix Grounding Mat for Feet, 16” x 24”(2Pack) Earth Mat Grounding Pad for Sleep, Boost Energy & Wellness, Earth Therapy, Grounding at Home, Office, Work | Includes Conductive Test Pen",B0DT6MC617,https://www.amazon.com/dp/B0DT6MC617/?th=1,11,--,3.80,12,0.15,0.18,0,0.14,0,0,2025-02-21,Urvoix,N/A
"Urvoix Grounding Mat for Feet, 16” x 24” Earth Mat Grounding Pad for Sleep, Boost Energy & Wellness, Earth Therapy, Grounding at Home, Office, Work | Includes Conductive Test Pen",B0DT6DBFB5,https://www.amazon.com/dp/B0DT6DBFB5/?th=1,11,19.94,4.10,12,0.19,0,0,0.70,0,0,2025-02-27,Urvoix,UrVoix
"Urvoix Grounding Mat for Feet, 12” x 24” Earth Mat Grounding Pad for Sleep, Boost Energy & Wellness, Earth Therapy, Grounding at Home, Office, Work | Includes Conductive Test Pen",B0DT68WC2H,https://www.amazon.com/dp/B0DT68WC2H/?th=1,11,19.99,4.10,12,0.03,0,0,0.09,0,0,2025-02-24,Urvoix,UrVoix
"Urvoix Grounding Mat for Feet, 35.4'x23.6' Earth Mat Grounding Pad for Bed, Grounding Mat Kit for Desk, Improve Sleep, Supports Energy, Relieve Anxiety w/ 15 Foot Cord & Conductive Test Pen",B0DT6CJD5P,https://www.amazon.com/dp/B0DT6CJD5P/?th=1,11,29.99,4.10,12,0.03,0,0,0.09,0,0,2025-01-16,Urvoix,UrVoix
"Urvoix Grounding Mat for Feet, 16' x 24'(2Pack) Earth Mat Grounding Pad for Bed Desk Office, Grounding Mat Kit for Wellness Energy, Improve Sleep, Reduce Anxiety w/ 15 Foot Cord & Conductive Test Pen",B0F2P1PR7J,https://www.amazon.com/dp/B0F2P1PR7J/?th=1,11,36.99,4.10,12,0.05,0,0,0.19,0,0,2025-03-27,Urvoix,UrVoix
Grounding Sheet with Grounding Cord - Materials Organic Cotton and Silver Fiber Natural Wellness (27 * 52 inch),B0815SB399,https://www.amazon.com/dp/B0815SB399/?th=1,10,18.39,3.90,1805,0.46,0.70,0,0,0,0,2019-12-02,CUAZCCS,maanshanbiemaiting
"Universal Grounding Mat Kit with 15ft Cord - 11.54x27 Inch Earth Mat for Better Sleep, Anxiety Relief & Inflammation Reduction",B083LXYKGG,https://www.amazon.com/dp/B083LXYKGG/?th=1,10,17.95,3.80,101,0.01,0,0,0.05,0,0,2020-02-19,NIULAFR,xinniushuinuan
"Grounding Twin Sheet Kit, 95% Cotton + 5% Silver Fiber, with Cord, Grey (27“x52“)",B09576HTH5,https://www.amazon.com/dp/B09576HTH5/?th=1,10,30.99,4.00,211,0.01,0,0,0.05,0,0,2021-05-19,NIULAFR,ninglifang
"Grounding Mat for Bed, 54x78inch, Breathable Grounding Mat, Contains a 15ft Grounding Cord, Grounding Bed Pad for Better Sleep, Improve Fitness, Reduce Stress and Pain",B0CX8SBNVS,https://www.amazon.com/dp/B0CX8SBNVS/?th=1,10,51.92,3.30,7,0.03,0.02,0,0.05,0,0,2024-05-11,LOYDBDT,LOYDBDT
"Grounding Mat (26.7 x 10 Inch) with 15ft Grounding Cord, Ground Foot Mats, Computer Mat, Sleep Mat, Pet,Soft & Conductive",B0D63CG6G5,https://www.amazon.com/dp/B0D63CG6G5/?th=1,10,--,4.40,10,0.06,0.08,0,0.05,0,0,2024-07-17,NPCSYYDS,N/A
"Grounding Sheet Kit, Grounding Flat Sheet with 15ft US Grounding Cable, Fits All Bed Sizes, Natural Cotton&Silver Fiber,HighConductivity Grounding Mat for Better Sleep (Twin,Grey)",B0DB195JBC,https://www.amazon.com/dp/B0DB195JBC/?th=1,10,19.10,4.00,216,0.03,0,0,0.09,0,0,2024-08-29,NIULAFR,ninglifang
"Grounding Sheet Kit, Grounding Flat Sheet with 15ft US Grounding Cable, Fits All Bed Sizes, Organic Cotton&Silver Fiber,100% Conductive Grounding Mat for Better Sleep (Twin XL), Gray",B0DB17SWW5,https://www.amazon.com/dp/B0DB17SWW5/?th=1,10,24.18,4.00,216,0.01,0,0,0.05,0,0,2024-08-01,NIULAFR,ninglifang
"Grounding Sheets, Grounding Flat Sheets with 95% Nature Cotton+ 5% Silver Fiber - High Conductivity with Grounding Cord, Grounding Keep Good Sleep, Natural Healthy (Twin-White)",B0DLGVFMPW,https://www.amazon.com/dp/B0DLGVFMPW/?th=1,10,23.18,4.00,213,0.03,0,0,0.09,0,0,2024-12-25,NIULAFR,ninglifang
Grounding Mat for Bed: Enjoy Grounding Effect Indoors for Better Sleep Pain and Stress Relief Grounding Mat Set Comes with Grounding Cord ROZ ZUM(Queen),B0DQBHY8YM,https://www.amazon.com/dp/B0DQBHY8YM/?th=1,10,34.99,4.20,8,0.35,0.49,0,0.09,0,0,2025-02-18,ROZ ZUM,ROZ ZUM-US
Grounding Mat- Reduce Stress & Relieve Inflammation- Durable Grounding Pad- 35” X 24”- Grounding Mat for Bed Improves Sleep & Calms Mind- Travel Cotton Tote Bag- Earthing- Health and Wellness Gifts,B0DQ9FLQ6T,https://www.amazon.com/dp/B0DQ9FLQ6T/?th=1,10,59.99,4.60,21,0.27,0,0,0.98,0,0,2025-03-09,State of Bliss,Your State of Bliss
"Grounding Mat for Bed, Grounded Pad for Sleep, Anti-Slip PU Leather Grounded Mat with Grounding Cord, 27’’×60‘’, Queen",B0DY4R2RL4,https://www.amazon.com/dp/B0DY4R2RL4/?th=1,10,--,3.70,11,0.27,0.33,0,0.19,0,0,2025-04-05,Dragsui,N/A
"Grounding Mat for Bed - Earth Grounding Mats, PU Leather Grounded Pad for Improve Sleep, Relaxation, Balanced Energy, Conductive Grounding Mattress Pad with Adjustable Straps (Queen (27 * 60 in))",B0F2FPQGXK,https://www.amazon.com/dp/B0F2FPQGXK/?th=1,10,34.99,4.80,5,0.03,0,0,0.09,0,0,2025-05-08,Sahanula,Inmetech
"Grounding Mat for Bed - Earth Grounding Mats, PU Leather Grounded Pad for Improve Sleep, Relaxation, Balanced Energy, Conductive Grounding Mattress Pad with Adjustable Straps (King (27 * 78 in))",B0F2FPWSZ1,https://www.amazon.com/dp/B0F2FPWSZ1/?th=1,10,44.99,4.80,5,0.05,0.04,0,0.09,0,0,2025-05-08,Sahanula,Inmetech
"Grounding Sleep Mat, 54‘‘x 71‘‘ Earthing Grounded Mat Perforated Design 100% Conductive Carbon Leatherette",B07VQT8KS2,https://www.amazon.com/dp/B07VQT8KS2/?th=1,9,71.08,4.00,215,0.22,0.33,0,0,0,0,2019-08-13,NeatEarthing,PUPPYMATE
"23.6” x 35.4” Grounding Mat Kit with 15ft Grounding Cord,Grounding Pad for Health Grounding Bed Mat for Foot Mat,Computer Mat, Sleep Mat, Pet Mat",B0CDX832DG,https://www.amazon.com/dp/B0CDX832DG/?th=1,9,22.17,3.90,62,0.03,0.02,0,0.05,0,0,2023-10-11,Jffszsd,foshan heathly
"9.8' x 26.7'Grounding Mat Kit with 15ft Grounding Cord,Grounding Pad for Health Grounding Bed Mat for Foot Mat,Computer Mat, Sleep Mat, Pet Mat",B0CR8HJZR7,https://www.amazon.com/dp/B0CR8HJZR7/?th=1,9,13.64,3.90,56,0.08,0.12,0,0,0,0,2024-03-04,Jffszsd,foshan heathly
Earthing 72“x23.6“ Colored Grounding Pad for Bed & Feet - Yoga Exercise Mat,B0CR16R28W,https://www.amazon.com/dp/B0CR16R28W/?th=1,9,59.49,4.40,88,0.44,0,7.16,0.19,0,0,2024-03-19,SoulHarmony,Home Brands Store
Earthing Mat 23.6'x35.4' - Colored Grounding Pad for Feet,B0CQVQXG11,https://www.amazon.com/dp/B0CQVQXG11/?th=1,9,46.49,4.40,88,0.40,0.06,0,1.30,0,0,2024-03-19,SoulHarmony,Home Brands Store
Grounding Mat 11.8'x23.6' - Colored Grounding Mat Earthing - Grounding Pad for Feet - Grounding Mouse Pad - Earthing Mat,B0CQVPW6S5,https://www.amazon.com/dp/B0CQVPW6S5/?th=1,9,29.59,4.40,88,0.25,0.37,0,0,0,0,2024-04-03,SoulHarmony,Home Brands Store
"Grounding Mat (26.7x10 Inch) Computer Mat, Sleep Mat,Earth Mat, Grounding Pad, Mat for Reduce Pain and Inflammation",B0DKH621W8,https://www.amazon.com/dp/B0DKH621W8/?th=1,9,16.99,3.70,19,0.03,0.02,0,0.05,0,0,2024-12-05,Horuoaii,Xinqi Home Furnishings
"Grounding Foot Rest for Under Desk at Work,Foot Stool for Office Use Gaming Chair Ergonomic Memory Foam Adjustable Height Back Knee Pain Relief, Pad Mat for Feet Wellness Organic Cotton Pure Silver",B0DPDT9XK8,https://www.amazon.com/dp/B0DPDT9XK8/?th=1,9,60.00,5.00,2,0.08,0,1.43,0,0,0,2025-01-14,ORLIOM,ORLIOM
"Grounding Mat, 23.6 * 15.7 inch - Reduce Anxiety & Stress, Earthing Mat for Better Sleep & Balance, Grounding Mat for Use at Home, Office, Work - Grounding Well Mat for Health",B0DV3FZDJZ,https://www.amazon.com/dp/B0DV3FZDJZ/?th=1,9,--,4.50,27,0.03,0.04,0,0,0,0,2025-01-24,DEMPOWER,N/A
"Puregrounding? Grounding Mat 16' x 24' for Sleep, Pain Relief, Anti-Inflammation, Mood, Indoor Grounding, Conductive Carbon",B0DT9MM4JW,https://www.amazon.com/dp/B0DT9MM4JW/?th=1,9,28.90,3.50,4,0.25,0.02,0,0.84,0,0,2025-01-27,PureGrounding,WellGrounded
"Grounding Mat with Upgraded Conductive PU - Enhanced Sleep, Energy, Pain Relief, and Wellness",B0F1FYQYH8,https://www.amazon.com/dp/B0F1FYQYH8/?th=1,9,19.89,3.00,6,0.04,0,0,0.14,0,0,2025-03-16,MCZAROA,MCZAROA?
"Grounding Mat for Bed 90% Organic Cotton+10% Pure Silver Fiber, Grounding Fitted Sheets for All Mattress Sizes, with Static grounding Cord and Test Pen (White, 105.2 * 23.5 inch)",B0DWJ9GX87,https://www.amazon.com/dp/B0DWJ9GX87/?th=1,9,39.99,2.40,5,0.22,0.33,0,0,0,0,2025-03-24,TWK,TWK-US
"Grounding Mat for Bed, Earth Connected Grounding Sheets Pad for Sleep, Stress Relief, PU Leather Grounding Mattress with Grounding Cord 27x60in, Queen",B0F536MP1T,https://www.amazon.com/dp/B0F536MP1T/?th=1,9,29.99,5.00,2,0.03,0,0,0.09,0,0,2024-09-30,TOPYGOEE,Orinstar
"Grounding Mat for Improved Sleep, Reduced Anxiety, Pain, Inflammation, Headache Relief, Balance. Grounded Therapy-(Black, (60.2 * 27.4inch))",B0DZGPXGYT,https://www.amazon.com/dp/B0DZGPXGYT/?th=1,9,35.00,1.00,1,0.17,0.25,0,0,0,0,2025-04-15,HLLBLL,Luonavei-US
"Floral Printed Universal Grounding Mat Kit, 23.6x35.4 Inch Bed Mat with 15 Ft Grounding Cord, Yoga Pad for Better Sleep, Stress & Pain Relief, Anxiety Reduction",B0CLGSGZ15,https://www.amazon.com/dp/B0CLGSGZ15/?th=1,8,28.05,4.00,51,0.31,0.47,0,0,0,0,2023-11-08,KABOUQI,kabuqi
