URL,产品,商家名字,地点,员工总数,成立时间,定制起订量,接外贸订单,认证,是否有说明书,起订量,价格,联系方式,其他
https://www.1688.com/factory/b2b-3933428634d1924.html,,深圳市佰友电子科技有限公司,广东省深圳市龙华区福城街道中顺颐泉产业园A栋,8人,2018.05.04,500个,不支持,"支持外贸订单, 清加工, 来样加工, AAA诚信等级, CCC认证, ISO 9000认证",,500个,,,
https://www.1688.com/factory/b2b-38940712729362b.html,,深圳寰球信瑞电子科技有限公司,广东省深圳市龙岗区南湾街道简竹路早禾坑工业区八号宇翔工业园F栋202,101~200人,2018.04.04,0,不支持,"来料代工加工, 可开专票, ISO 9000认证, 支持来样加工, 支持外贸订单, AAA诚信等级",,0,,,
https://www.1688.com/factory/b2b-22005492856409c3ac.html,,东莞市嘉际电子有限公司,广东东莞塘厦镇蛟龙路5号2栋601室,34人,2018.03.19,100套,不支持,"支持外贸订单, 来样加工, 来图加工, 可开专票, 质量控制, 工贸一体, AAA诚信等级, 东莞机械五金, CCC认证, ISO 9000认证",,100套,,,
https://www.1688.com/factory/b2b-2211807735036629b2.html,,深圳派瑞克科技有限公司,广东省深圳市龙岗区广东深圳龙岗区南湾街道吉厦社区早禾坑8号F栋502,5人,2021.05.21,1000个,不支持,"支持拿样, 支持外贸订单, AA诚信等级, 清加工, 支持来图加工, 来样加工, 可开专票, CCC认证, ISO 9000认证",,1000个,,,
https://shop3302p839474q2.1688.com/page/creditdetail.htm?spm=a2615.27861609.wp_pc_common_topnav.0,,,,,,,,,,,,,
